Article Title,Slug,Category,Sub-Category,Owner,Tags,Body (HTML),Meta Description
DLP Policy Configuration,dlp-policy-configuration,Data Protection,DLP,Wilson S,"dlp, policies, configuration","<h2>DLP Policy Essentials</h2><p>DLP policies define what data to protect, where to enforce protection, and what actions to take when violations occur. Effective policies balance security with usability, preventing data loss without blocking legitimate business activities.</p><img src=""https://source.unsplash.com/600x400/?policy,configuration"" alt=""DLP Policy Configuration""><h2>Policy Components</h2><p>Policies include data identification rules defining sensitive content, conditions specifying when policies apply (users, destinations, apps), and actions taken on violations (alert, block, encrypt, quarantine). Exceptions accommodate legitimate business needs.</p><h2>Data Classification</h2><p>Base policies on data classification: public (no restrictions), internal (basic controls), confidential (strict controls), restricted (maximum protection). Classification-based policies provide consistent, scalable protection aligned with data sensitivity.</p><h2>Policy Tuning</h2><p>Initial policies generate false positives requiring tuning. Analyze incidents, refine detection rules, adjust sensitivity thresholds, create exceptions for legitimate patterns, and educate users. Iterative tuning improves accuracy and user acceptance.</p><h2>Advanced Policies</h2><p>Advanced capabilities include contextual policies considering recipient, time, location, risk score; data tagging for persistent protection; remediation workflows requiring approval for sensitive transfers; and integration with rights management for encryption.</p>","Configure DLP policies to prevent data exfiltration."
Email DLP Solutions,email-dlp-solutions,Data Protection,DLP,Wilson S,"email, dlp, security","<h2>Email DLP Importance</h2><p>Email remains primary vector for data loss through misdirected messages, attachment errors, and malicious exfiltration. Email DLP inspects outbound email content and attachments, preventing sensitive data leakage while maintaining business communication.</p><img src=""https://source.unsplash.com/600x400/?email,security"" alt=""Email DLP""><h2>Email DLP Capabilities</h2><p>Email DLP scans message content and attachments for sensitive data, checks recipient domains and addresses, analyzes conversation context, enforces encryption for sensitive emails, and provides user notifications educating about violations.</p><h2>Detection Methods</h2><p>Email DLP uses content analysis (data type detection), attachment scanning including compressed files, image OCR for screenshots, contextual analysis of subject and body, and behavioral analysis flagging unusual sending patterns.</p><h2>Enforcement Actions</h2><p>Actions include user notifications requesting confirmation, manager approval workflows for sensitive data, automatic encryption of qualifying emails, blocking delivery and quarantine for policy violations, and logging for audit and investigation.</p><h2>User Experience</h2><p>Balance security with productivity through clear policy communication, educational notifications explaining violations, streamlined approval processes, and exceptions for trusted partners. Poor user experience leads to shadow IT bypassing controls.</p>","Prevent data leaks through email with DLP solutions."
Endpoint DLP Strategies,endpoint-dlp-strategies,Data Protection,DLP,Wilson S,"endpoint, dlp, protection","<h2>Endpoint DLP Overview</h2><p>Endpoint DLP protects data in use, monitoring and controlling data on user devices. Endpoint DLP prevents data loss through removable media, cloud uploads, printing, screen captures, and unauthorized applications while data is actively used.</p><img src=""https://source.unsplash.com/600x400/?endpoint,protection"" alt=""Endpoint DLP""><h2>Endpoint Monitoring</h2><p>Endpoint agents monitor file operations, clipboard usage, screen captures, application access, network transfers, USB device connections, printer usage, and cloud application uploads. Comprehensive monitoring ensures no data leakage paths remain unprotected.</p><h2>Device Control</h2><p>Control removable media through USB blocking or allow-listing, encrypt data written to approved devices, restrict printer access for sensitive documents, control cloud storage applications, and manage wireless transfers (Bluetooth, AirDrop).</p><h2>Integration with Encryption</h2><p>Combine endpoint DLP with file encryption for defense in depth. DLP prevents unauthorized copying, encryption protects if prevention fails. Together they provide comprehensive data protection on endpoints against various threat scenarios.</p><h2>Deployment Considerations</h2><p>Endpoint DLP impacts user productivity and requires careful deployment. Start with monitoring mode, communicate policies clearly, provide exceptions for legitimate workflows, optimize agent performance, and ensure offline protection when devices disconnect from network.</p>","Deploy endpoint DLP strategies to secure data on devices."
Cloud DLP Implementation,cloud-dlp-implementation,Data Protection,DLP,Wilson S,"cloud, dlp, security","<h2>Cloud DLP Challenges</h2><p>Cloud adoption introduces data loss risks through unmanaged cloud applications, data sharing via cloud services, and limited visibility into cloud data flows. Cloud DLP extends protection to SaaS applications and cloud storage securing data beyond corporate perimeter.</p><img src=""https://source.unsplash.com/600x400/?cloud,data"" alt=""Cloud DLP""><h2>CASB for Cloud DLP</h2><p>Cloud Access Security Brokers (CASB) provide cloud DLP through API connections to sanctioned applications and inline proxies for all cloud traffic. CASBs discover shadow IT, enforce policies, and prevent data loss across cloud services.</p><h2>SaaS DLP Capabilities</h2><p>SaaS DLP inspects data in cloud applications, monitors sharing and permissions, enforces policies on cloud storage, scans cloud email, controls downloads, and applies encryption or rights management to sensitive cloud data.</p><h2>Cloud-Native DLP</h2><p>Major cloud providers offer native DLP: Microsoft 365 DLP, Google Workspace DLP, AWS Macie. Cloud-native DLP integrates tightly with cloud services, provides comprehensive coverage, and simplifies management for cloud-first organizations.</p><h2>Implementation Approach</h2><p>Discover cloud application usage, classify data in cloud services, extend existing DLP policies to cloud, address shadow IT through user education and approved alternatives, monitor cloud data sharing, and integrate cloud DLP with existing security infrastructure.</p>","Implement DLP for cloud applications and services."
GDPR Compliance Guide,gdpr-compliance-guide,Data Protection,Privacy & Compliance,Wilson S,"gdpr, privacy, compliance","<h2>GDPR Overview</h2><p>General Data Protection Regulation (GDPR) is EU privacy law protecting personal data of EU residents. GDPR applies to organizations processing EU personal data regardless of location, imposing strict requirements for data protection, privacy rights, and breach notification.</p><img src=""https://source.unsplash.com/600x400/?gdpr,privacy"" alt=""GDPR Compliance""><h2>Core Principles</h2><p>GDPR principles include lawful, fair, transparent processing; purpose limitation; data minimization; accuracy; storage limitation; integrity and confidentiality; and accountability. Organizations must demonstrate compliance through documentation and controls.</p><h2>Key Requirements</h2><p>Requirements include lawful basis for processing, explicit consent for sensitive data, data subject rights (access, rectification, erasure, portability), breach notification within 72 hours, Data Protection Impact Assessments (DPIA), and Data Protection Officer (DPO) for large-scale processing.</p><h2>Technical Controls</h2><p>Implement encryption for data protection, pseudonymization for privacy, access controls limiting data access, audit trails for accountability, automated data retention and deletion, and privacy by design in systems and processes.</p><h2>Compliance Program</h2><p>Build GDPR compliance through data mapping identifying personal data, privacy policies, consent management, subject rights fulfillment processes, vendor management for data processors, training programs, and regular compliance audits.</p>","Achieve GDPR compliance with this comprehensive guide."
CCPA Requirements,ccpa-requirements,Data Protection,Privacy & Compliance,Wilson S,"ccpa, california, privacy","<h2>CCPA Overview</h2><p>California Consumer Privacy Act (CCPA) grants California residents rights over personal information including access, deletion, opt-out of sale, and non-discrimination. CCPA applies to businesses meeting revenue, data volume, or revenue from data sale thresholds.</p><img src=""https://source.unsplash.com/600x400/?privacy,california"" alt=""CCPA Compliance""><h2>Consumer Rights</h2><p>CCPA rights include knowing what personal information is collected, deleting personal information, opting out of personal information sale, non-discrimination for exercising rights, and (under CPRA) correction of inaccurate information.</p><h2>Business Obligations</h2><p>Businesses must provide privacy notices disclosing data practices, enable rights exercise through accessible mechanisms, respond to requests within 45 days, maintain reasonable security, and update privacy policies annually or when material changes occur.</p><h2>Do Not Sell Requirement</h2><p>CCPA requires 'Do Not Sell My Personal Information' links enabling opt-out. Businesses must honor opt-out requests, not sell minor data without opt-in, and ensure service providers don't sell data through contractual restrictions.</p><h2>Implementation Steps</h2><p>Assess CCPA applicability, map personal information collection and sharing, update privacy notices, implement consumer rights request processes, train staff, establish verification procedures, and maintain compliance documentation.</p>","Understand and meet CCPA requirements for data privacy."
Data Privacy Impact Assessment,data-privacy-impact-assessment,Data Protection,Privacy & Compliance,Wilson S,"dpia, privacy, assessment","<h2>DPIA Purpose</h2><p>Data Privacy Impact Assessments (DPIA) systematically analyze processing operations' privacy risks. GDPR mandates DPIAs for high-risk processing, helping organizations identify and mitigate privacy risks before implementing systems or processes.</p><img src=""https://source.unsplash.com/600x400/?assessment,privacy"" alt=""Privacy Impact Assessment""><h2>When DPIA is Required</h2><p>DPIAs are mandatory for systematic large-scale monitoring, large-scale sensitive data processing, automated decision-making with legal effects, processing involving new technologies, or data matching. Organizations should conduct DPIAs proactively for any concerning processing.</p><h2>DPIA Process</h2><p>DPIA process includes describing processing operations, assessing necessity and proportionality, identifying privacy risks to individuals, evaluating risk severity and likelihood, determining mitigation measures, and documenting outcomes with stakeholder consultation.</p><h2>Risk Mitigation</h2><p>Privacy risk mitigation includes technical controls (encryption, pseudonymization), organizational measures (policies, training), data minimization reducing collected data, transparency through clear communication, and rights facilitation enabling individual control.</p><h2>Documentation and Review</h2><p>Document DPIA findings, risk analysis, mitigation decisions, and stakeholder input. DPIAs require DPO review, possible supervisory authority consultation for high residual risks, and periodic reassessment when processing changes or new risks emerge.</p>","Conduct Data Privacy Impact Assessments (DPIA) effectively."
Privacy by Design,privacy-by-design,Data Protection,Privacy & Compliance,Wilson S,"privacy, design, principles","<h2>Privacy by Design Principles</h2><p>Privacy by Design (PbD) embeds privacy into technology and business practices from inception. PbD is proactive, preventative, and makes privacy the default, ensuring systems protect privacy automatically without user intervention.</p><img src=""https://source.unsplash.com/600x400/?design,privacy"" alt=""Privacy by Design""><h2>Seven Foundational Principles</h2><p>PbD principles: proactive not reactive, privacy as default setting, privacy embedded into design, full functionality (positive-sum), end-to-end security, visibility and transparency, and respect for user privacy through user-centric design.</p><h2>Implementation Techniques</h2><p>Techniques include data minimization collecting only necessary data, pseudonymization separating identity from data, encryption protecting data, access controls limiting data access, retention limits, and privacy-preserving analytics.</p><h2>Development Integration</h2><p>Integrate PbD into SDLC through privacy requirements gathering, threat modeling including privacy risks, privacy-focused architecture, secure coding for privacy, privacy testing, and privacy review before deployment.</p><h2>Organizational Culture</h2><p>PbD requires organizational commitment through privacy training, cross-functional collaboration between privacy and engineering teams, privacy champions, privacy metrics, and leadership support for privacy investments and decisions.</p>","Build privacy into your systems with Privacy by Design principles."
Data Subject Rights,data-subject-rights,Data Protection,Privacy & Compliance,Wilson S,"privacy, rights, gdpr","<h2>Individual Privacy Rights</h2><p>Privacy regulations grant individuals rights over their personal data including access, rectification, erasure, data portability, and objection to processing. Organizations must implement processes enabling efficient rights exercise and timely fulfillment.</p><img src=""https://source.unsplash.com/600x400/?rights,privacy"" alt=""Data Subject Rights""><h2>Right of Access</h2><p>Individuals can request copies of personal data being processed. Organizations must provide data categories, processing purposes, retention periods, recipients, automated decision-making information, and actual data copy in accessible format within regulatory timeframes.</p><h2>Right to Erasure</h2><p>Right to be forgotten allows deletion requests when data no longer necessary, consent withdrawn, objection raised, or unlawful processing occurs. Exceptions include legal obligations, public interest, and legitimate business needs requiring careful evaluation.</p><h2>Data Portability</h2><p>Data portability enables receiving personal data in structured, machine-readable format and transmitting to another controller. Portability supports user control and service switching, requiring technical capabilities for data export in standard formats.</p><h2>Request Management</h2><p>Establish request intake mechanisms (web forms, email), identity verification preventing fraudulent requests, request routing to appropriate teams, response within regulatory deadlines (typically 30 days), and documentation for accountability and improvement.</p>","Manage data subject rights requests under privacy regulations."
Backup and Recovery Planning,backup-and-recovery-planning,Data Protection,Backup & DR,Wilson S,"backup, disaster recovery, planning","<h2>Backup and DR Importance</h2><p>Backup and disaster recovery ensure business continuity after data loss from hardware failure, cyber attacks, natural disasters, or human error. Comprehensive planning minimizes downtime, data loss, and operational impact during incidents.</p><img src=""https://source.unsplash.com/600x400/?backup,recovery"" alt=""Backup Planning""><h2>Backup Strategy</h2><p>Implement 3-2-1 rule: 3 data copies, 2 different media types, 1 offsite copy. Include full backups periodically, incremental/differential backups frequently, and immutable backups protecting against ransomware encryption or deletion.</p><h2>Recovery Objectives</h2><p>Define Recovery Time Objective (RTO) for acceptable downtime and Recovery Point Objective (RPO) for acceptable data loss. These metrics guide backup frequency, retention, and technology selection balancing business needs with costs.</p><h2>Testing and Validation</h2><p>Regular backup testing validates recovery capability. Perform test restores, full disaster recovery exercises, document recovery procedures, measure RTO/RPO achievement, and update plans based on lessons learned.</p><h2>Disaster Recovery Planning</h2><p>DR plans include incident response procedures, communication protocols, recovery prioritization, alternate site operations, vendor contacts, and detailed recovery steps for critical systems. Regular plan updates address changing infrastructure and business requirements.</p>","Create comprehensive backup and disaster recovery plans."
Cloud Backup Solutions,cloud-backup-solutions,Data Protection,Backup & DR,Wilson S,"cloud backup, recovery, solutions","<h2>Cloud Backup Benefits</h2><p>Cloud backup provides offsite storage without physical infrastructure, geographic redundancy, scalability, and automated backup management. Cloud solutions offer cost-effective disaster recovery for organizations of all sizes.</p><img src=""https://source.unsplash.com/600x400/?cloud,backup"" alt=""Cloud Backup""><h2>Cloud Backup Types</h2><p>Options include backup-as-a-service (BaaS) for automated cloud backup, disaster-recovery-as-a-service (DRaaS) for complete failover, cloud-to-cloud backup for SaaS data protection, and hybrid solutions combining on-premises and cloud storage.</p><h2>Solution Selection</h2><p>Evaluate solutions based on supported data sources, retention capabilities, encryption options, recovery speed, geographic redundancy, compliance certifications, pricing models, and integration with existing infrastructure.</p><h2>Security Considerations</h2><p>Ensure cloud backup security through encryption in transit and at rest, client-side encryption for zero-knowledge security, access controls, multi-factor authentication, immutable backups preventing ransomware encryption, and compliance with data residency requirements.</p><h2>Implementation Best Practices</h2><p>Test restore procedures regularly, monitor backup success/failure, implement retention policies aligned with compliance, validate encryption, maintain redundant backup copies in multiple regions, and document recovery procedures for various scenarios.</p>","Choose the right cloud backup solution for your organization."
Ransomware Recovery,ransomware-recovery,Data Protection,Backup & DR,Wilson S,"ransomware, recovery, backup","<h2>Ransomware Recovery Challenges</h2><p>Ransomware encrypts data demanding ransom for decryption keys. Effective recovery depends on secure, tested backups that ransomware cannot encrypt. Modern ransomware targets backups, requiring specific protections for recovery capability.</p><img src=""https://source.unsplash.com/600x400/?ransomware,recovery"" alt=""Ransomware Recovery""><h2>Backup Protection</h2><p>Protect backups through network isolation, immutable storage preventing modification, offline backups disconnected from networks, separate authentication from production systems, and monitoring for unauthorized backup access or deletion attempts.</p><h2>Recovery Process</h2><p>Ransomware recovery includes incident containment and network isolation, forensic investigation identifying infection vector, clean system rebuild or restoration, backup validation ensuring no malware, staged data restoration starting with critical systems, and verification before reconnecting.</p><h2>Decision Framework</h2><p>Establish pre-incident decision framework for ransom payment considering: recovery capability from backups, data sensitivity and impact, law enforcement guidance, payment likelihood of successful decryption, and organizational policy on negotiating with criminals.</p><h2>Post-Recovery Actions</h2><p>After recovery, conduct incident review, strengthen security controls based on attack vector, enhance backup protection, improve detection capabilities, update incident response plans, and share threat intelligence with community.</p>","Recover from ransomware attacks with proper backup strategies."
Business Continuity Planning,business-continuity-planning,Data Protection,Backup & DR,Wilson S,"bcp, continuity, planning","<h2>BCP Fundamentals</h2><p>Business Continuity Planning (BCP) ensures critical operations continue during disruptions. BCP encompasses processes, procedures, and resources enabling organizational resilience against disasters, cyber attacks, infrastructure failures, or other interruptions.</p><img src=""https://source.unsplash.com/600x400/?business,continuity"" alt=""Business Continuity""><h2>Business Impact Analysis</h2><p>BIA identifies critical business functions, assesses disruption impacts, determines maximum tolerable downtime, defines recovery priorities, and documents dependencies. BIA findings guide recovery strategy and resource allocation decisions.</p><h2>Continuity Strategies</h2><p>Strategies include alternate site operations (hot, warm, cold sites), work-from-home capabilities, manual workarounds, vendor alternatives, redundant systems and infrastructure, and cross-training enabling staff flexibility during disruptions.</p><h2>Plan Development</h2><p>BCP includes emergency response procedures, notification and escalation protocols, recovery teams and responsibilities, detailed recovery steps, resource requirements, vendor contacts, communication templates, and success criteria for resuming operations.</p><h2>Testing and Maintenance</h2><p>Regular BCP testing through tabletop exercises, functional tests, and full simulations validates plan effectiveness. Update plans for organizational changes, technology updates, lessons learned, and evolving threat landscape.</p>","Develop business continuity plans for operational resilience."
Backup Testing Procedures,backup-testing-procedures,Data Protection,Backup & DR,Wilson S,"backup, testing, validation","<h2>Backup Testing Importance</h2><p>Untested backups provide false security—many organizations discover backup failures only when recovery is needed. Regular testing validates backup integrity, recovery procedures, and team capabilities ensuring reliable recovery when required.</p><img src=""https://source.unsplash.com/600x400/?testing,validation"" alt=""Backup Testing""><h2>Testing Methods</h2><p>Testing approaches include file-level restore tests for specific files, full system restoration in isolated environments, disaster recovery exercises simulating complete failures, and automated validation checking backup integrity and completeness.</p><h2>Test Planning</h2><p>Test plans specify frequency based on data criticality, scope covering different backup types and systems, success criteria including RTO/RPO metrics, resource requirements, and documentation procedures capturing results and issues.</p><h2>Recovery Validation</h2><p>Beyond successful restoration, validate data integrity, application functionality, performance characteristics, security controls, and interdependencies. Incomplete testing may miss issues preventing actual production recovery.</p><h2>Continuous Improvement</h2><p>Use test results to improve backup strategies, update recovery procedures, identify training needs, optimize RTO/RPO, and enhance automation. Document lessons learned and implement corrective actions before actual disasters occur.</p>","Test and validate backups to ensure recovery capability."
AWS Security Best Practices,aws-security-best-practices,Cloud Security,AWS,Wilson S,"aws, cloud, security","<h2>AWS Security Overview</h2><p>Amazon Web Services (AWS) security follows shared responsibility model—AWS secures infrastructure, customers secure workloads. Understanding this model and implementing comprehensive controls is essential for secure AWS deployments.</p><img src=""https://source.unsplash.com/600x400/?aws,cloud"" alt=""AWS Security""><h2>Identity and Access Management</h2><p>AWS IAM best practices include no root account usage, individual IAM users or SSO, least privilege permissions, MFA enforcement, regular credential rotation, and service-specific roles instead of long-term credentials.</p><h2>Network Security</h2><p>Secure AWS networks through VPC isolation, security groups as stateful firewalls, network ACLs for subnet-level filtering, private subnets for sensitive resources, VPC flow logs for traffic visibility, and AWS WAF for application protection.</p><h2>Data Protection</h2><p>Protect AWS data through encryption at rest using KMS, encryption in transit with TLS, S3 bucket policies preventing public access, versioning for data protection, and backup strategies using AWS Backup or snapshots.</p><h2>Monitoring and Compliance</h2><p>Enable CloudTrail for API logging, GuardDuty for threat detection, Config for configuration monitoring, Security Hub for centralized security visibility, and compliance automation using AWS services and third-party tools.</p>","Secure your AWS environment with these best practices."
