Article Title,Slug,Category,Sub-Category,Owner,Tags,Body (HTML),Meta Description
Vulnerability Disclosure Programs,vulnerability-disclosure-programs,Threat Intelligence,Vulnerability Management,Wilson S,"disclosure, vulnerability, responsible","<h2>Vulnerability Disclosure Overview</h2><p>Vulnerability disclosure programs provide structured processes for security researchers to report vulnerabilities. Programs balance security improvement through researcher engagement with protecting organizational reputation and managing remediation.</p><img src=""https://source.unsplash.com/600x400/?disclosure,security"" alt=""Vulnerability Disclosure""><h2>Program Types</h2><p>Coordinated disclosure provides embargoes for patching before public disclosure. Bug bounty programs offer financial rewards. Public disclosure policies define disclosure timelines and processes. Private programs limit participation to invited researchers.</p><h2>Program Components</h2><p>Effective programs include clear scope defining covered systems, submission process and contacts, response commitments and timelines, legal safe harbor protecting researchers, and recognition or rewards for valid findings.</p><h2>Response Process</h2><p>Establish triage process for submissions, severity assessment, communication with researchers, coordinated remediation, and public disclosure coordination. Timely, professional response encourages continued researcher engagement.</p><h2>Legal Considerations</h2><p>Provide legal safe harbor in program policies, align with DMCA exemptions, comply with CFAA, establish research authorization, and work with legal counsel ensuring program protects both organization and researchers.</p>","Establish vulnerability disclosure programs engaging security researchers."
Zero-Day Vulnerability Response,zero-day-vulnerability-response,Threat Intelligence,Vulnerability Management,Wilson S,"zero-day, response, mitigation","<h2>Zero-Day Response Overview</h2><p>Zero-day vulnerabilities have no available patches requiring rapid risk assessment, mitigation, and response. Organizations must detect exploitation attempts, implement compensating controls, and prepare for eventual patching.</p><img src=""https://source.unsplash.com/600x400/?zero-day,vulnerability"" alt=""Zero-Day Response""><h2>Detection Strategies</h2><p>Detect zero-day exploitation through behavioral monitoring for anomalies, threat intelligence about exploitation in wild, IDS/IPS signature updates, sandbox analysis of suspicious files, and vulnerability scanning detecting indicators.</p><h2>Mitigation Approaches</h2><p>Mitigate without patches using virtual patching via IPS/WAF, application whitelisting preventing exploitation, network segmentation limiting exposure, access restrictions reducing attack surface, and enhanced monitoring for exploitation.</p><h2>Emergency Response</h2><p>Establish emergency patching processes, crisis communication plans, vendor engagement procedures, incident response activation triggers, and business continuity plans for critical zero-day scenarios affecting operations.</p><h2>Preparedness</h2><p>Prepare for zero-days through comprehensive asset inventory enabling rapid impact assessment, vulnerability management maturity, threat intelligence subscriptions, security tool coverage, and practiced emergency response procedures.</p>","Respond to zero-day vulnerabilities with mitigation and emergency procedures."
Single Sign-On Security,single-sign-on-security-best-practices,Identity & Access,SSO Security,Wilson S,"sso, security, authentication","<h2>SSO Security Considerations</h2><p>Single Sign-On (SSO) improves user experience but creates single point of compromise. Compromised SSO credentials grant access to multiple applications requiring enhanced SSO security beyond traditional authentication.</p><img src=""https://source.unsplash.com/600x400/?sso,login"" alt=""SSO Security""><h2>Strong Authentication</h2><p>Implement multi-factor authentication for SSO, risk-based authentication increasing security for sensitive access, hardware tokens or FIDO2 for high-assurance needs, and continuous authentication monitoring session risk.</p><h2>Session Management</h2><p>Secure SSO sessions through appropriate timeouts, session binding to device/location, re-authentication for sensitive operations, secure session storage, and comprehensive session logging for security monitoring.</p><h2>Federation Security</h2><p>Secure federation through certificate validation, SAML assertion encryption and signing, token validation preventing replay attacks, proper audience restriction, and secure metadata exchange with federation partners.</p><h2>Monitoring and Response</h2><p>Monitor SSO for authentication anomalies, impossible travel, credential stuffing attempts, and session hijacking. Implement automated response including session revocation, account lockout, and security team alerting.</p>","Secure single sign-on implementations with enhanced authentication and monitoring."
Identity Federation Best Practices,identity-federation-best-practices,Identity & Access,Federation,Wilson S,"federation, identity, saml","<h2>Identity Federation Overview</h2><p>Identity federation enables SSO across organizational boundaries through trust relationships. Federation uses SAML, OAuth, or OpenID Connect for authentication delegation requiring careful security implementation.</p><img src=""https://source.unsplash.com/600x400/?federation,identity"" alt=""Identity Federation""><h2>Trust Establishment</h2><p>Establish federation trust through certificate exchange and validation, metadata configuration, attribute mapping agreements, policy alignment, and legal agreements defining responsibilities and liabilities between identity and service providers.</p><h2>Assertion Security</h2><p>Secure SAML assertions through digital signatures preventing tampering, encryption protecting confidentiality, short validity periods limiting replay, audience restrictions, and unique assertion IDs preventing replay attacks.</p><h2>Attribute Release</h2><p>Implement least privilege attribute release, attribute filtering based on service requirements, user consent for attribute sharing, privacy protection through minimal disclosure, and regular attribute release reviews.</p><h2>Monitoring and Audit</h2><p>Monitor federation for authentication patterns, failed authentications, attribute release, federation relationship changes, and policy violations. Maintain audit trails for compliance and security incident investigation.</p>","Implement secure identity federation with proper trust and attribute management."
Cloud Identity Management,cloud-identity-management,Identity & Access,Cloud IAM,Wilson S,"cloud identity, iam, management","<h2>Cloud Identity Challenges</h2><p>Cloud identity management addresses multi-cloud environments, SaaS applications, and hybrid infrastructure. Organizations need unified identity across cloud providers, consistent policies, and centralized visibility.</p><img src=""https://source.unsplash.com/600x400/?cloud,identity"" alt=""Cloud Identity""><h2>Identity Provider Selection</h2><p>Choose centralized cloud identity provider (Okta, Azure AD, Google Workspace) or federate existing on-premises identity. Consider cloud coverage, application support, security features, scalability, and integration capabilities.</p><h2>Multi-Cloud IAM</h2><p>Manage identity across AWS, Azure, and GCP through federation from central IdP, consistent role definitions, automated provisioning, and unified access policies. Avoid separate identities per cloud creating management overhead.</p><h2>SaaS Application Integration</h2><p>Integrate SaaS applications using SAML or OAuth, implement automated provisioning and deprovisioning, enforce MFA, apply conditional access policies, and monitor SaaS access for security and compliance.</p><h2>Security Best Practices</h2><p>Implement least privilege cloud IAM, use temporary credentials, enable comprehensive logging, regular access reviews, privileged access management for cloud administration, and cloud security posture management.</p>","Manage cloud identity across multi-cloud and SaaS environments."
Insider Threat Detection,insider-threat-detection-prevention,Identity & Access,Threat Detection,Wilson S,"insider threat, detection, ueba","<h2>Insider Threat Overview</h2><p>Insider threats arise from employees, contractors, or partners with authorized access. Threats include malicious insiders stealing data, negligent users causing breaches, and compromised accounts enabling external attacks.</p><img src=""https://source.unsplash.com/600x400/?insider,threat"" alt=""Insider Threat""><h2>Insider Threat Indicators</h2><p>Behavioral indicators include unusual access patterns, off-hours activity, excessive downloads, access to unneeded data, use of personal devices, and attempts to bypass security. Technical indicators include authentication anomalies and data movement.</p><h2>UEBA Solutions</h2><p>User and Entity Behavior Analytics (UEBA) establish behavioral baselines, detect anomalies, apply risk scoring, and correlate across data sources. UEBA identifies insider threats traditional security tools miss.</p><h2>Technical Controls</h2><p>Implement least privilege access, DLP preventing data exfiltration, comprehensive logging, network segmentation, privileged access management, and two-person integrity for sensitive operations.</p><h2>Organizational Approach</h2><p>Combine technical controls with HR collaboration, background checks, security awareness, clear policies, reporting mechanisms, and investigation procedures. Insider threat requires holistic people, process, and technology approach.</p>","Detect and prevent insider threats using UEBA and comprehensive controls."
Data Encryption at Rest,data-encryption-at-rest,Data Protection,Encryption,Wilson S,"encryption, data at rest, storage","<h2>Encryption at Rest Overview</h2><p>Encryption at rest protects stored data from unauthorized access on lost/stolen devices, unauthorized access, or physical theft. Implementation varies from full disk encryption to database and application-level encryption.</p><img src=""https://source.unsplash.com/600x400/?encryption,storage"" alt=""Encryption at Rest""><h2>Full Disk Encryption</h2><p>FDE encrypts entire disk protecting all data with technologies like BitLocker (Windows), FileVault (macOS), and dm-crypt (Linux). FDE provides transparent protection but doesn't protect against authorized access or runtime attacks.</p><h2>Database Encryption</h2><p>Database encryption includes Transparent Data Encryption (TDE) encrypting files, column-level encryption for sensitive fields, and application-level encryption providing end-to-end protection. Choose based on security requirements and query functionality needs.</p><h2>Cloud Storage Encryption</h2><p>Cloud storage offers server-side encryption (provider managed), customer-managed keys (CMK) for control, or client-side encryption for maximum security. Understand shared responsibility and key management implications.</p><h2>Key Management</h2><p>Effective encryption requires secure key generation, protected key storage using HSMs or KMS, regular key rotation, secure key backup and recovery, and comprehensive key lifecycle management.</p>","Implement encryption at rest protecting stored data across systems and cloud."
Data Encryption in Transit,data-encryption-in-transit,Data Protection,Encryption,Wilson S,"encryption, tls, transit","<h2>Encryption in Transit Overview</h2><p>Encryption in transit protects data during transmission preventing eavesdropping, man-in-the-middle attacks, and tampering. TLS/SSL is standard for web traffic with additional protocols for specific use cases.</p><img src=""https://source.unsplash.com/600x400/?encryption,network"" alt=""Encryption in Transit""><h2>TLS Implementation</h2><p>Implement TLS 1.2 minimum (prefer TLS 1.3), use strong cipher suites with forward secrecy, configure proper certificate validation, implement certificate pinning for critical connections, and enable HSTS forcing HTTPS.</p><h2>VPN Encryption</h2><p>VPN encryption protects network communications using IPSec with strong algorithms, SSL/TLS VPN, or modern solutions like WireGuard. Configure proper authentication, perfect forward secrecy, and split-tunneling carefully.</p><h2>Email Encryption</h2><p>Protect email using opportunistic TLS for transport, S/MIME or PGP for end-to-end encryption, and secure email gateways. Understand that standard email encryption doesn't protect subject lines or metadata.</p><h2>Application Protocols</h2><p>Encrypt application protocols through TLS wrapping (HTTPS, FTPS, LDAPS), protocol-native encryption (SSH), or application-level encryption. Ensure encryption covers all sensitive communication channels.</p>","Implement encryption in transit protecting data during transmission."
Cloud Data Protection,cloud-data-protection-strategies,Data Protection,Cloud Security,Wilson S,"cloud, data protection, security","<h2>Cloud Data Protection Challenges</h2><p>Cloud data protection addresses shared responsibility, data residency, multi-tenancy, and provider access risks. Organizations must understand provider controls and implement additional protections based on data sensitivity.</p><img src=""https://source.unsplash.com/600x400/?cloud,data"" alt=""Cloud Data Protection""><h2>Shared Responsibility</h2><p>Cloud providers secure infrastructure; customers secure data, access, and applications. Understand provider responsibilities (physical, infrastructure), customer responsibilities (data classification, encryption, access), and shared areas (patching, configuration).</p><h2>Data Classification</h2><p>Classify cloud data by sensitivity, apply appropriate protections per classification, restrict sensitive data locations based on compliance, and use data discovery tools identifying sensitive data in cloud storage.</p><h2>Encryption and Keys</h2><p>Implement encryption at rest and in transit, use customer-managed keys (CMK or BYOK) for control, consider client-side encryption for highest sensitivity, and protect encryption keys separately from data.</p><h2>Access Controls</h2><p>Implement least privilege cloud access, use IAM policies, enable MFA, bucket policies preventing public access, access logging, and regular access reviews ensuring appropriate data protection.</p>","Protect data in cloud with encryption, access controls, and classification."
GDPR Data Subject Rights,gdpr-data-subject-rights-management,Data Protection,Privacy,Wilson S,"gdpr, data rights, privacy","<h2>Data Subject Rights Under GDPR</h2><p>GDPR grants EU residents rights over personal data including access, rectification, erasure, portability, and restriction of processing. Organizations must implement processes enabling efficient rights fulfillment within regulatory timeframes.</p><img src=""https://source.unsplash.com/600x400/?privacy,rights"" alt=""Data Subject Rights""><h2>Right of Access</h2><p>Individuals can request copies of personal data being processed. Organizations must provide data categories, purposes, recipients, retention periods, and actual data in accessible format within one month.</p><h2>Right to Erasure</h2><p>Right to be forgotten allows deletion when data no longer necessary, consent withdrawn, objection raised, or unlawful processing. Exceptions include legal obligations and legitimate interests requiring careful evaluation.</p><h2>Data Portability</h2><p>Individuals can receive personal data in structured, machine-readable format and transmit to another controller. Implement data export capabilities in common formats (CSV, JSON) enabling portability.</p><h2>Implementation Process</h2><p>Implement request intake and verification, identity validation preventing fraudulent requests, data discovery across systems, request routing to responsible teams, response within deadlines, and comprehensive logging for compliance demonstration.</p>","Manage GDPR data subject rights with compliant processes and systems."
