Article Title,Slug,Category,Sub-Category,Owner,Tags,Body (HTML),Meta Description
SAML Authentication Guide,saml-authentication-guide,Identity & Access,Authentication,Wilson S,"saml, sso, authentication","<h2>SAML Overview</h2><p>Security Assertion Markup Language (SAML) is an XML-based standard for exchanging authentication and authorization data between identity providers and service providers. SAML enables enterprise single sign-on and federation.</p><img src=""https://source.unsplash.com/600x400/?authentication,enterprise"" alt=""SAML Authentication""><h2>SAML Architecture</h2><p>SAML architecture involves Identity Provider (IdP) authenticating users, Service Provider (SP) relying on IdP assertions, trust established through metadata exchange, and SAML assertions containing authentication and attribute statements.</p><h2>Authentication Flow</h2><p>SAML authentication uses SP-initiated flow (user starts at application) or IdP-initiated flow (user starts at portal). SP redirects to IdP, user authenticates, IdP creates signed assertion, browser posts to SP, SP validates and grants access.</p><h2>Security Considerations</h2><p>SAML security requires assertion signing and encryption, certificate management, secure metadata exchange, assertion validation including timestamps and audience restrictions, and protection against replay attacks through message IDs.</p><h2>Troubleshooting</h2><p>Common SAML issues include clock skew between IdP and SP, certificate mismatches, incorrect attribute mapping, metadata synchronization problems, and assertion validation failures. SAML tracer tools help diagnose issues.</p>","Deploy SAML-based authentication for enterprise single sign-on."
Biometric Authentication,biometric-authentication,Identity & Access,Authentication,Wilson S,"biometric, authentication, security","<h2>Biometric Authentication Fundamentals</h2><p>Biometric authentication uses unique biological characteristics for identity verification including fingerprints, facial recognition, iris scanning, voice recognition, and behavioral biometrics. Biometrics provide convenient, strong authentication.</p><img src=""https://source.unsplash.com/600x400/?biometric,fingerprint"" alt=""Biometric Authentication""><h2>Biometric Technologies</h2><p>Fingerprint scanners use ridge patterns, facial recognition analyzes facial geometry, iris scanners examine eye patterns, voice recognition identifies vocal characteristics, and behavioral biometrics monitor typing rhythm, gait, or mouse movements.</p><h2>Security and Privacy</h2><p>Biometric security requires template protection through encryption and secure storage, liveness detection preventing spoofing, privacy protection through local processing, and fallback authentication methods for failure scenarios.</p><h2>Implementation Challenges</h2><p>Challenges include false acceptance/rejection rates, environmental factors affecting recognition, disability accessibility, privacy concerns, template database security, and irrevocability of biometric credentials if compromised.</p><h2>Best Practices</h2><p>Implement biometrics as one factor in multi-factor authentication, store templates locally when possible, use liveness detection, provide alternative authentication methods, comply with biometric privacy regulations, and obtain user consent.</p>","Implement biometric authentication methods for enhanced security."
Passwordless Authentication,passwordless-authentication,Identity & Access,Authentication,Wilson S,"passwordless, authentication, fido2","<h2>Passwordless Revolution</h2><p>Passwordless authentication eliminates passwords using alternative factors like biometrics, hardware tokens, or magic links. Passwordless approaches improve security by removing password vulnerabilities while enhancing user experience.</p><img src=""https://source.unsplash.com/600x400/?passwordless,security"" alt=""Passwordless Authentication""><h2>Passwordless Technologies</h2><p>Technologies include FIDO2/WebAuthn for phishing-resistant authentication, biometric authentication, hardware security keys, authenticator apps with push notifications, magic links via email, and SMS-based one-time codes.</p><h2>FIDO2/WebAuthn</h2><p>FIDO2 combines web authentication API (WebAuthn) with CTAP protocol enabling strong authentication using public key cryptography. Users register authenticators (security keys, platform authenticators) creating credential pairs for passwordless login.</p><h2>Implementation Strategy</h2><p>Transition to passwordless gradually: enable passwordless as option alongside passwords, encourage adoption through user education, provide fallback methods, monitor adoption rates, and eventually enforce passwordless for all users.</p><h2>Benefits and Challenges</h2><p>Benefits include phishing resistance, elimination of password reuse, reduced help desk costs, and improved user experience. Challenges include device dependency, backup authentication methods, and user education for new authentication paradigms.</p>","Transition to passwordless authentication with FIDO2 and WebAuthn."
Certificate-Based Authentication,certificate-based-authentication,Identity & Access,Authentication,Wilson S,"certificates, pki, authentication","<h2>Certificate Authentication Overview</h2><p>Certificate-based authentication uses digital certificates from Public Key Infrastructure (PKI) to verify identity. Certificates provide strong, cryptographic authentication suitable for users, devices, and applications requiring high assurance.</p><img src=""https://source.unsplash.com/600x400/?certificate,security"" alt=""Certificate Authentication""><h2>PKI Components</h2><p>PKI includes Certificate Authority (CA) issuing certificates, Registration Authority (RA) verifying identities, certificate repositories, revocation mechanisms (CRL, OCSP), and trust anchors (root certificates) establishing trust chains.</p><h2>Certificate Types</h2><p>User certificates identify individuals, device certificates authenticate machines, code signing certificates verify software, email certificates enable secure communication, and SSL/TLS certificates secure websites and services.</p><h2>Implementation</h2><p>Deploy certificate authentication through smart cards, USB tokens, or software certificates. Configure systems to require and validate certificates, implement certificate enrollment processes, and establish certificate lifecycle management.</p><h2>Certificate Management</h2><p>Lifecycle management includes certificate issuance, renewal before expiration, revocation when compromised, monitoring expiration dates, maintaining CRLs/OCSP, and key escrow for recovery. Automation reduces manual errors and outages.</p>","Use certificate-based authentication for strong identity verification."
Role-Based Access Control,role-based-access-control,Identity & Access,Authorization,Wilson S,"rbac, access control, permissions","<h2>RBAC Fundamentals</h2><p>Role-Based Access Control (RBAC) assigns permissions to roles instead of individual users. Users receive roles based on job functions, inheriting associated permissions. RBAC simplifies administration and enforces organizational security policies.</p><img src=""https://source.unsplash.com/600x400/?access,management"" alt=""Role-Based Access Control""><h2>RBAC Components</h2><p>RBAC includes users (individuals), roles (job functions), permissions (allowed operations), and sessions (user activating roles). Additional components include role hierarchies (inheritance) and constraints (separation of duties).</p><h2>Role Design</h2><p>Design roles based on job functions, responsibilities, and business processes. Create role hierarchies for permission inheritance, implement separation of duties preventing conflicting permissions, and maintain role granularity balancing administration and security.</p><h2>Implementation Strategy</h2><p>Start by inventorying existing permissions, group into logical roles, map users to roles, implement role assignment workflows, establish regular access reviews, and use role mining tools to identify patterns and optimize role structures.</p><h2>RBAC Advantages</h2><p>Benefits include simplified administration through role reuse, improved compliance through consistent access, reduced errors from manual assignment, easier auditing, and scalability for growing organizations with standardized job functions.</p>","Implement role-based access control for granular permissions management."
Attribute-Based Access Control,attribute-based-access-control,Identity & Access,Authorization,Wilson S,"abac, access control, policies","<h2>ABAC Overview</h2><p>Attribute-Based Access Control (ABAC) makes access decisions based on attributes of users, resources, actions, and environment. ABAC provides dynamic, fine-grained access control adapting to complex contexts beyond role assignments.</p><img src=""https://source.unsplash.com/600x400/?policy,access"" alt=""Attribute-Based Access Control""><h2>Attribute Types</h2><p>Subject attributes (user department, clearance level), resource attributes (data classification, owner), action attributes (read, write, delete), and environmental attributes (time, location, threat level) combine in policies determining access.</p><h2>Policy Language</h2><p>ABAC policies use languages like XACML defining rules based on attribute combinations. Policies express complex logic: 'Allow if user.department equals resource.owner AND time between 9-5 AND location equals office'.</p><h2>Implementation</h2><p>ABAC implementation requires attribute management, policy authoring and testing, centralized policy decision points (PDP), policy enforcement points (PEP) at resources, and policy administration points (PAP) for management.</p><h2>Use Cases</h2><p>ABAC excels for multi-tenancy, data classification enforcement, context-aware access (time/location), cross-organizational collaboration, and dynamic environments where role-based approaches are too rigid or complex.</p>","Deploy attribute-based access control for dynamic authorization."
Just-In-Time Access,just-in-time-access,Identity & Access,Authorization,Wilson S,"jit, privileged access, temporary","<h2>JIT Access Principles</h2><p>Just-In-Time (JIT) access provides temporary privilege elevation only when needed, for specific duration. JIT reduces standing privileges, minimizes attack surface, and limits damage from compromised credentials through time-bound access.</p><img src=""https://source.unsplash.com/600x400/?access,temporary"" alt=""Just-In-Time Access""><h2>JIT Implementation</h2><p>JIT solutions include automated approval workflows, temporary group membership, on-demand account creation, privilege elevation for specific tasks, and automatic access revocation after time expiration or task completion.</p><h2>Approval Workflows</h2><p>JIT workflows involve access request with business justification, automated or manual approval based on policies, temporary credential provisioning, access monitoring during session, and automatic revocation with comprehensive audit trails.</p><h2>Integration with PAM</h2><p>Integrate JIT with Privileged Access Management for comprehensive privileged access control. Combine JIT provisioning with credential vaulting, session monitoring, and analytics for complete privileged access governance and security.</p><h2>Benefits</h2><p>JIT reduces standing privileges limiting exposure, provides audit trail for privileged activities, enforces approval workflows ensuring oversight, prevents privilege accumulation, and enables compliance with least privilege principle.</p>","Implement just-in-time access for temporary privilege elevation."
Least Privilege Principle,least-privilege-principle,Identity & Access,Authorization,Wilson S,"least privilege, access control, security","<h2>Least Privilege Fundamentals</h2><p>The Principle of Least Privilege (PoLP) states users should have minimum access necessary to perform job functions. Least privilege reduces attack surface, limits breach impact, and prevents accidental or malicious misuse.</p><img src=""https://source.unsplash.com/600x400/?privilege,security"" alt=""Least Privilege""><h2>Implementation Strategies</h2><p>Implement least privilege through access reviews identifying excessive permissions, role refinement creating granular roles, privilege separation for sensitive operations, temporary elevation for administrative tasks, and default-deny policies.</p><h2>Challenges</h2><p>Least privilege challenges include resistance from users accustomed to broad access, operational impact from overly restrictive permissions, complexity of determining minimum required access, and ongoing maintenance as job functions evolve.</p><h2>Application to Systems</h2><p>Apply least privilege to user accounts, service accounts, applications, processes, and network access. Service accounts particularly require attention as they often have excessive privileges persisting indefinitely without oversight.</p><h2>Monitoring and Enforcement</h2><p>Continuous monitoring for privilege creep, regular access certification, automated privilege revocation, anomaly detection for unusual privilege usage, and policy enforcement through technical controls maintain least privilege over time.</p>","Apply the principle of least privilege across your organization."
Permission Auditing,permission-auditing,Identity & Access,Authorization,Wilson S,"auditing, permissions, compliance","<h2>Permission Auditing Importance</h2><p>Regular permission auditing identifies inappropriate access, privilege creep, orphaned accounts, and compliance violations. Auditing ensures access remains aligned with business needs and security policies throughout organizational changes.</p><img src=""https://source.unsplash.com/600x400/?audit,compliance"" alt=""Permission Auditing""><h2>Audit Methodology</h2><p>Permission audits include access certification where managers review team access, entitlement reviews validating role permissions, orphaned account identification, segregation of duties verification, and privileged access audits for high-risk permissions.</p><h2>Automated Auditing</h2><p>Automation accelerates auditing through identity governance platforms, automated access reviews with manager workflows, anomaly detection flagging unusual permissions, and continuous compliance monitoring against policies and regulations.</p><h2>Audit Frequency</h2><p>Audit frequency depends on risk: quarterly for privileged access, semi-annually for standard users, immediately after role changes or terminations, and continuous automated monitoring for real-time compliance.</p><h2>Remediation Process</h2><p>Audit findings require remediation workflows: excessive permission removal, orphaned account deletion, role refinement, policy updates, and exception documentation for legitimate business needs with compensating controls.</p>","Audit and review permissions regularly for security and compliance."
Data Encryption Standards,data-encryption-standards,Data Protection,Encryption,Wilson S,"encryption, aes, standards","<h2>Encryption Fundamentals</h2><p>Data encryption transforms plaintext into ciphertext using algorithms and keys, protecting confidentiality. Modern encryption standards use mathematically strong algorithms resistant to cryptanalysis, providing security for data at rest and in transit.</p><img src=""https://source.unsplash.com/600x400/?encryption,security"" alt=""Data Encryption""><h2>Symmetric Encryption</h2><p>Symmetric encryption (AES, ChaCha20) uses same key for encryption and decryption. AES with 256-bit keys is industry standard, providing strong security with excellent performance for bulk data encryption.</p><h2>Asymmetric Encryption</h2><p>Asymmetric encryption (RSA, ECC) uses public/private key pairs. Public keys encrypt data only private keys can decrypt, enabling secure key exchange, digital signatures, and authentication. Common in TLS, email encryption, and authentication.</p><h2>Algorithm Selection</h2><p>Choose algorithms based on security requirements, compliance mandates, performance needs, and compatibility. Use AES-256 for symmetric, RSA 2048+ or ECC for asymmetric, and SHA-256+ for hashing. Avoid deprecated algorithms like DES, MD5.</p><h2>Implementation Best Practices</h2><p>Use established libraries, never implement custom cryptography, generate keys using cryptographically secure random number generators, protect keys rigorously, use authenticated encryption modes (GCM), and maintain crypto-agility for algorithm updates.</p>","Understand modern data encryption standards and algorithms."
End-to-End Encryption,end-to-end-encryption,Data Protection,Encryption,Wilson S,"e2ee, encryption, privacy","<h2>E2EE Overview</h2><p>End-to-End Encryption (E2EE) ensures data is encrypted on sender's device and only decrypted on recipient's device, with no intermediate party able to access plaintext. E2EE provides maximum privacy for communications and data sharing.</p><img src=""https://source.unsplash.com/600x400/?encryption,privacy"" alt=""End-to-End Encryption""><h2>E2EE Architecture</h2><p>E2EE uses client-side encryption where keys never leave user devices. Protocols like Signal Protocol provide forward secrecy, ensuring past communications remain secure even if current keys are compromised through ephemeral key exchanges.</p><h2>Implementation Challenges</h2><p>E2EE challenges include key distribution and management, device verification preventing man-in-middle attacks, backup and recovery without key escrow, multi-device synchronization, and balancing security with features like search.</p><h2>Use Cases</h2><p>E2EE is essential for messaging apps, email clients, file sharing, cloud storage, video conferencing, and any scenario requiring privacy from service providers, governments, or intermediate parties who control infrastructure.</p><h2>Regulatory Considerations</h2><p>E2EE creates tension with data retention, lawful access, and compliance requirements. Organizations must balance privacy benefits with regulatory obligations, considering jurisdiction-specific requirements and business needs.</p>","Implement end-to-end encryption for maximum data privacy."
Encryption Key Management,encryption-key-management,Data Protection,Encryption,Wilson S,"key management, encryption, kms","<h2>Key Management Importance</h2><p>Encryption security depends on key protection—compromised keys render encryption useless. Effective key management encompasses generation, distribution, storage, rotation, backup, destruction, and audit throughout key lifecycles.</p><img src=""https://source.unsplash.com/600x400/?keys,security"" alt=""Key Management""><h2>Key Lifecycle</h2><p>Key lifecycle includes generation using cryptographically secure methods, distribution through secure channels, storage in hardware security modules (HSMs) or key management services, rotation at regular intervals, and secure destruction when expired.</p><h2>Key Management Solutions</h2><p>Solutions include on-premises HSMs for maximum control, cloud KMS (AWS KMS, Azure Key Vault, GCP KMS) for scalability, and hybrid approaches. Features include centralized management, access controls, audit logging, and automatic rotation.</p><h2>Best Practices</h2><p>Separate data encryption keys (DEKs) from key encryption keys (KEKs), implement key rotation, maintain key backups for disaster recovery, enforce least privilege for key access, use HSMs for critical keys, and maintain comprehensive key audit trails.</p><h2>Regulatory Compliance</h2><p>Compliance frameworks mandate key management controls: FIPS 140-2 validation for cryptographic modules, key separation, rotation requirements, and audit trails. Cloud KMS services often provide compliance certifications simplifying regulatory adherence.</p>","Best practices for encryption key management and lifecycle."
Database Encryption Methods,database-encryption-methods,Data Protection,Encryption,Wilson S,"database, encryption, tde","<h2>Database Encryption Overview</h2><p>Database encryption protects sensitive data in databases from unauthorized access, theft, or breach. Encryption methods include Transparent Data Encryption (TDE), column-level encryption, and application-level encryption with different trade-offs.</p><img src=""https://source.unsplash.com/600x400/?database,encryption"" alt=""Database Encryption""><h2>Transparent Data Encryption</h2><p>TDE encrypts entire database files at rest without application changes. Database engine handles encryption/decryption transparently, protecting against storage theft. TDE is implemented by major databases: SQL Server, Oracle, MySQL, PostgreSQL.</p><h2>Column-Level Encryption</h2><p>Column encryption protects specific sensitive fields like SSN, credit cards. Data is encrypted in database, applications decrypt when authorized. Provides granular protection but requires application awareness and key management.</p><h2>Application-Level Encryption</h2><p>Applications encrypt data before database storage, providing end-to-end protection. Database sees only ciphertext, preventing database administrator access, but complicates queries, indexing, and performance optimization.</p><h2>Implementation Considerations</h2><p>Consider performance impact (encryption overhead), key management complexity, backup encryption, compliance requirements, and query functionality. TDE offers easiest implementation, column/application encryption provide stronger security with higher complexity.</p>","Encrypt databases with Transparent Data Encryption and other methods."
File and Folder Encryption,file-and-folder-encryption,Data Protection,Encryption,Wilson S,"file encryption, bitlocker, security","<h2>File Encryption Overview</h2><p>File and folder encryption protects data at rest on endpoints and servers. Encryption prevents unauthorized access to files on lost/stolen devices, protects against insider threats, and secures sensitive data throughout its lifecycle.</p><img src=""https://source.unsplash.com/600x400/?files,encryption"" alt=""File Encryption""><h2>Full Disk Encryption</h2><p>Full Disk Encryption (FDE) encrypts entire drives using BitLocker (Windows), FileVault (macOS), or LUKS (Linux). FDE provides transparent protection for all data, preventing access without authentication, ideal for laptop and mobile device security.</p><h2>File-Level Encryption</h2><p>File-level encryption encrypts individual files or folders, allowing selective protection of sensitive data. Solutions include EFS (Windows), individual file encryption tools, and cloud storage encryption. Provides granular control but requires user discipline.</p><h2>Enterprise Solutions</h2><p>Enterprise encryption management platforms centralize key management, enforce encryption policies, provide recovery mechanisms, support multiple platforms, and integrate with identity systems for access control and compliance reporting.</p><h2>Best Practices</h2><p>Implement pre-boot authentication for FDE, enable secure key backup and recovery, enforce encryption policies through management tools, protect keys with TPM or HSM, document recovery procedures, and regularly test recovery processes.</p>","Protect files and folders with encryption solutions."
Data Loss Prevention,data-loss-prevention,Data Protection,DLP,Wilson S,"dlp, data protection, prevention","<h2>DLP Fundamentals</h2><p>Data Loss Prevention (DLP) detects and prevents unauthorized data exfiltration. DLP identifies sensitive data through content inspection, monitors data movement across networks, endpoints, and cloud, and enforces policies to prevent accidental or malicious data loss.</p><img src=""https://source.unsplash.com/600x400/?data,protection"" alt=""Data Loss Prevention""><h2>DLP Components</h2><p>DLP architecture includes data discovery identifying sensitive data locations, policy engine defining protection rules, monitoring agents on networks/endpoints/cloud, and enforcement actions from alerting to blocking data transfers.</p><h2>Detection Techniques</h2><p>DLP detects sensitive data using pattern matching (regex for SSN, credit cards), keyword searches, document fingerprinting, machine learning classification, and contextual analysis combining multiple signals for accurate detection with minimal false positives.</p><h2>DLP Deployment Models</h2><p>Deploy DLP at network perimeter monitoring outbound traffic, on endpoints protecting data in use, in email gateways preventing data leakage, and in cloud applications (CASB) securing SaaS environments.</p><h2>Implementation Strategy</h2><p>Start with discovery to understand data locations and flows, define data classification, create policies starting with monitoring, educate users, gradually enforce blocking, and continuously tune policies reducing false positives while improving coverage.</p>","Implement Data Loss Prevention (DLP) to protect sensitive information."
