Article Title,Slug,Category,Sub-Category,Owner,Tags,Body (HTML),Meta Description
Azure Security Configuration,azure-security-configuration,Cloud Security,Azure,Wilson S,"azure, cloud, security","<h2>Azure Security Fundamentals</h2><p>Microsoft Azure provides comprehensive security capabilities across identity, network, data, and application layers. Proper configuration of native security services and adherence to best practices ensures secure Azure deployments.</p><img src=""https://source.unsplash.com/600x400/?azure,security"" alt=""Azure Security""><h2>Azure AD Security</h2><p>Secure Azure AD through conditional access policies, MFA enforcement, privileged identity management (PIM) for JIT admin access, identity protection for risk-based policies, and seamless SSO for user experience.</p><h2>Network Protection</h2><p>Azure network security includes VNet isolation, network security groups (NSGs) for traffic filtering, Azure Firewall for advanced protection, DDoS protection, private endpoints avoiding public exposure, and Azure Bastion for secure RDP/SSH.</p><h2>Data Security</h2><p>Protect Azure data through Azure Storage encryption, Key Vault for secrets management, SQL Transparent Data Encryption, Azure Information Protection for data classification, and Customer Managed Keys for control.</p><h2>Threat Protection</h2><p>Enable Microsoft Defender for Cloud for workload protection, Sentinel for SIEM/SOAR, Advanced Threat Protection services, and security posture management providing recommendations and compliance monitoring.</p>","Configure Microsoft Azure security controls effectively."
GCP Security Guide,gcp-security-guide,Cloud Security,GCP,Wilson S,"gcp, google cloud, security","<h2>GCP Security Overview</h2><p>Google Cloud Platform (GCP) security leverages Google's infrastructure security expertise. Understanding GCP-specific security services and configuration best practices ensures robust protection for cloud workloads and data.</p><img src=""https://source.unsplash.com/600x400/?google,cloud"" alt=""GCP Security""><h2>Identity and Access</h2><p>GCP IAM uses hierarchical permissions with organization, folder, project levels. Best practices include service accounts for applications, least privilege through predefined or custom roles, workload identity for GKE, and Cloud Identity for user management.</p><h2>Network Security</h2><p>Secure GCP networks through VPC isolation, firewall rules for traffic control, Cloud Armor for DDoS and WAF protection, Private Google Access avoiding internet routing, and VPC Service Controls for data perimeter protection.</p><h2>Data Protection</h2><p>GCP data protection includes default encryption at rest, Cloud KMS for key management, customer-managed encryption keys (CMEK), VPC Service Controls preventing data exfiltration, and DLP API for sensitive data discovery.</p><h2>Security Operations</h2><p>Enable Cloud Logging for audit trails, Security Command Center for security posture, Event Threat Detection for threat identification, and Chronicle for security analytics providing comprehensive security visibility and threat response.</p>","Comprehensive security guide for Google Cloud Platform."
Multi-Cloud Security,multi-cloud-security,Cloud Security,Multi-Cloud,Wilson S,"multi-cloud, security, strategy","<h2>Multi-Cloud Challenges</h2><p>Multi-cloud strategies using multiple cloud providers offer flexibility and resilience but introduce security complexity. Inconsistent security controls, varied interfaces, and distributed visibility require specialized approaches for comprehensive protection.</p><img src=""https://source.unsplash.com/600x400/?multicloud,security"" alt=""Multi-Cloud Security""><h2>Unified Security Framework</h2><p>Establish consistent security framework across clouds including common policies, standardized controls, unified identity management, centralized logging, and common security tooling providing cross-cloud visibility and control.</p><h2>Identity Federation</h2><p>Implement federated identity across cloud providers enabling SSO and consistent access controls. Use central IdP (Azure AD, Okta) federating to AWS, Azure, GCP, ensuring unified authentication and authorization.</p><h2>Security Tool Selection</h2><p>Choose cloud-agnostic security tools supporting multiple providers: CSPM for posture management, CWPP for workload protection, CASB for SaaS security, and multi-cloud SIEM for centralized monitoring and correlation.</p><h2>Operational Considerations</h2><p>Multi-cloud security requires cross-cloud expertise, consistent automation through IaC, unified incident response procedures, comprehensive asset inventory, and regular security assessments covering all cloud environments.</p>","Secure multi-cloud environments with unified security strategy."
Cloud Security Posture Management,cloud-security-posture-management,Cloud Security,CSPM,Wilson S,"cspm, cloud security, posture","<h2>CSPM Overview</h2><p>Cloud Security Posture Management (CSPM) continuously assesses cloud configurations against security best practices and compliance requirements. CSPM identifies misconfigurations, provides remediation guidance, and enables security teams to maintain secure cloud environments.</p><img src=""https://source.unsplash.com/600x400/?cloud,management"" alt=""CSPM""><h2>Core Capabilities</h2><p>CSPM provides configuration assessment against benchmarks (CIS, NIST), misconfiguration detection, compliance monitoring, risk prioritization, automated remediation, and continuous monitoring as cloud environments change dynamically.</p><h2>Common Misconfigurations</h2><p>CSPM detects issues like public storage buckets, overly permissive network rules, missing encryption, excessive IAM permissions, unpatched systems, disabled logging, and non-compliant resource configurations that introduce security risks.</p><h2>Implementation</h2><p>Deploy CSPM through cloud-native tools (AWS Security Hub, Azure Security Center, GCP Security Command Center) or third-party platforms (Prisma Cloud, Orca). Connect to cloud accounts via APIs, enable continuous assessment, and integrate with workflows.</p><h2>Remediation Process</h2><p>CSPM findings require prioritization based on risk, assignment to cloud teams, remediation through manual fixes or automated scripts, validation of fixes, and policy updates preventing recurrence through preventive controls.</p>","Implement Cloud Security Posture Management (CSPM) solutions."
Container Security,container-security,Cloud Security,Containers,Wilson S,"containers, docker, security","<h2>Container Security Challenges</h2><p>Containers provide application portability and efficiency but introduce security considerations including image vulnerabilities, runtime protection, orchestration security, and secrets management. Comprehensive security throughout container lifecycle is essential.</p><img src=""https://source.unsplash.com/600x400/?container,docker"" alt=""Container Security""><h2>Image Security</h2><p>Secure container images through vulnerability scanning, minimal base images reducing attack surface, trusted registries, image signing and verification, regular image updates, and removal of unnecessary tools and packages from production containers.</p><h2>Runtime Protection</h2><p>Runtime security includes least privilege for container processes, read-only filesystems where possible, resource limits preventing DoS, security policies (AppArmor, SELinux), and runtime threat detection identifying anomalous behavior.</p><h2>Registry Security</h2><p>Secure container registries through access controls limiting push/pull permissions, image signing ensuring authenticity, vulnerability scanning before deployment, private registries for sensitive images, and audit logging tracking image access.</p><h2>Secrets Management</h2><p>Never embed secrets in images. Use external secret stores (Vault, cloud secret managers), mount secrets at runtime, implement secret rotation, encrypt secrets in transit and rest, and audit secret access.</p>","Secure containerized applications and Docker environments."
Kubernetes Security,kubernetes-security,Cloud Security,Containers,Wilson S,"kubernetes, k8s, security","<h2>Kubernetes Security Overview</h2><p>Kubernetes orchestrates containers at scale but requires comprehensive security across API server, etcd, nodes, workloads, and networks. K8s security involves configuration hardening, access controls, network policies, and runtime protection.</p><img src=""https://source.unsplash.com/600x400/?kubernetes,security"" alt=""Kubernetes Security""><h2>Authentication and Authorization</h2><p>Secure K8s access through RBAC for fine-grained permissions, service account restrictions, pod security standards, admission controllers enforcing policies, and API server authentication using certificates or OIDC integration.</p><h2>Network Security</h2><p>Implement network policies for pod-to-pod traffic control, service mesh for encrypted inter-service communication, ingress security with WAF, and network segmentation isolating namespaces and workloads based on sensitivity.</p><h2>Workload Security</h2><p>Harden workloads through pod security policies/standards, running non-root containers, read-only root filesystems, resource limits, security contexts, and runtime security solutions detecting abnormal container behavior.</p><h2>Cluster Hardening</h2><p>Harden clusters through API server security configuration, etcd encryption, regular K8s updates, audit logging, secrets encryption at rest, and CIS Kubernetes Benchmark compliance providing comprehensive security baseline.</p>","Harden Kubernetes clusters for production security."
Cloud Access Security Brokers,cloud-access-security-brokers,Cloud Security,CASB,Wilson S,"casb, cloud security, broker","<h2>CASB Overview</h2><p>Cloud Access Security Brokers (CASB) enforce security policies for cloud applications. CASBs provide visibility into cloud usage, data protection, threat detection, and compliance across SaaS, PaaS, and IaaS services.</p><img src=""https://source.unsplash.com/600x400/?cloud,broker"" alt=""CASB""><h2>CASB Architecture</h2><p>CASB deployment modes include API-based for sanctioned app control via API connections, inline proxy for real-time policy enforcement on all cloud traffic, and hybrid combining both approaches for comprehensive protection.</p><h2>Core Capabilities</h2><p>CASB provides shadow IT discovery, cloud DLP preventing data leakage, threat protection against malware and anomalies, compliance monitoring, access control, and encryption for data protection in untrusted cloud applications.</p><h2>Use Cases</h2><p>CASB addresses shadow IT visibility and control, data protection in cloud applications, cloud compliance enforcement, insider threat detection, account compromise identification, and risk assessment of cloud services based on security posture.</p><h2>Implementation</h2><p>Deploy CASB by identifying critical cloud applications, choosing deployment mode based on use cases, configuring policies for data protection and access control, enabling threat detection, and integrating with SIEM for security operations.</p>","Deploy Cloud Access Security Brokers (CASB) for cloud protection."
Serverless Security,serverless-security,Cloud Security,Serverless,Wilson S,"serverless, lambda, security","<h2>Serverless Security Challenges</h2><p>Serverless computing abstracts infrastructure but introduces unique security considerations including function permissions, event-driven vulnerabilities, dependency risks, and limited visibility. Securing serverless requires adapting traditional and new security practices.</p><img src=""https://source.unsplash.com/600x400/?serverless,cloud"" alt=""Serverless Security""><h2>Function Security</h2><p>Secure serverless functions through least privilege IAM roles, input validation preventing injection attacks, secret management using parameter stores, dependency scanning for vulnerable libraries, and code signing ensuring function integrity.</p><h2>API Gateway Security</h2><p>Protect serverless APIs through authentication and authorization, rate limiting and throttling, request validation, WAF integration, API keys for access control, and logging for security monitoring and incident response.</p><h2>Data Protection</h2><p>Serverless data security includes encryption in transit and rest, environment variable encryption, secure temporary storage, data retention limits, and DLP for sensitive data handling in functions.</p><h2>Monitoring and Response</h2><p>Monitor serverless environments through cloud-native logging, distributed tracing, anomaly detection for unusual invocations, security analytics, and automated response to security events using serverless incident response functions.</p>","Secure serverless functions and architectures."
Cloud Compliance Monitoring,cloud-compliance-monitoring,Cloud Security,Compliance,Wilson S,"cloud, compliance, monitoring","<h2>Cloud Compliance Challenges</h2><p>Cloud environments' dynamic nature complicates compliance with constantly changing resources, distributed teams making changes, and diverse services requiring different controls. Continuous compliance monitoring ensures adherence despite rapid change.</p><img src=""https://source.unsplash.com/600x400/?compliance,monitoring"" alt=""Cloud Compliance""><h2>Compliance Frameworks</h2><p>Cloud compliance addresses multiple frameworks including SOC 2, PCI DSS, HIPAA, GDPR, FedRAMP, and ISO 27001. Each framework has specific cloud control requirements for data protection, access, logging, and configuration management.</p><h2>Automated Compliance</h2><p>Automate compliance through policy-as-code, continuous configuration assessment, automatic remediation of drift, compliance dashboards, and compliance reports for auditors. Automation maintains compliance despite rapid infrastructure changes.</p><h2>Cloud Compliance Tools</h2><p>Use cloud-native compliance tools (AWS Config, Azure Policy, GCP Security Command Center) and third-party platforms providing multi-cloud compliance monitoring, automated auditing, and compliance reporting capabilities.</p><h2>Audit Preparation</h2><p>Prepare for audits through comprehensive logging, configuration documentation, access reviews, control evidence collection, and compliance artifacts. Cloud automation facilitates evidence gathering reducing audit burden.</p>","Monitor cloud compliance with automated tools and frameworks."
