Article Title,Slug,Category,Sub-Category,Owner,Tags,Body (HTML),Meta Description
SOC 2 Audit Preparation,soc-2-audit-preparation,Compliance & Governance,Audits,Wilson S,"soc 2, audit, compliance","<h2>SOC 2 Overview</h2><p>SOC 2 audits evaluate service organization controls for security, availability, processing integrity, confidentiality, and privacy. SOC 2 reports demonstrate to customers that organizations have effective controls protecting their data.</p><img src=""https://source.unsplash.com/600x400/?audit,compliance"" alt=""SOC 2 Audit""><h2>Trust Service Criteria</h2><p>SOC 2 based on Trust Service Criteria: Security (foundational), Availability, Processing Integrity, Confidentiality, and Privacy. Organizations select applicable criteria based on services and customer requirements.</p><h2>Type 1 vs Type 2</h2><p>Type 1 evaluates control design at point in time, Type 2 evaluates operating effectiveness over period (typically 6-12 months). Type 2 provides greater assurance but requires sustained control operation.</p><h2>Audit Preparation</h2><p>Prepare through readiness assessment, control design and implementation, policy and procedure documentation, evidence collection, internal testing, remediation of gaps, and selecting qualified CPA firm as auditor.</p><h2>Ongoing Compliance</h2><p>SOC 2 requires continuous compliance through regular control execution, evidence collection, change management, risk assessments, and periodic audits. Automation and centralized evidence repositories streamline ongoing compliance.</p>","Prepare for SOC 2 audits with this comprehensive guide."
Security Policy Development,security-policy-development,Compliance & Governance,Policies,Wilson S,"policy, security, governance","<h2>Security Policy Purpose</h2><p>Security policies define organizational security requirements, acceptable behaviors, and responsibilities. Policies provide governance framework, guide decision-making, support compliance, and establish accountability.</p><img src=""https://source.unsplash.com/600x400/?policy,governance"" alt=""Security Policy""><h2>Policy Hierarchy</h2><p>Policy framework includes high-level policies defining broad requirements, standards specifying mandatory controls, guidelines providing best practices, and procedures detailing implementation steps. Clear hierarchy ensures comprehensive coverage.</p><h2>Essential Policies</h2><p>Core security policies include Information Security Policy (overarching), Acceptable Use Policy, Access Control Policy, Data Classification Policy, Incident Response Policy, Password Policy, Remote Access Policy, and change management.</p><h2>Development Process</h2><p>Policy development involves identifying requirements from regulations and risks, stakeholder consultation, drafting clear language, legal review, management approval, communication and training, and establishing review cycles.</p><h2>Policy Enforcement</h2><p>Effective policies require communication and training, technical enforcement through controls, violation consequences, exception processes for legitimate needs, and regular compliance monitoring demonstrating policy effectiveness.</p>","Develop effective security policies and procedures."
Risk Assessment Methods,risk-assessment-methods,Compliance & Governance,Risk Management,Wilson S,"risk assessment, methods, security","<h2>Risk Assessment Fundamentals</h2><p>Risk assessment identifies, analyzes, and evaluates information security risks. Assessments inform risk treatment decisions, prioritize investments, and demonstrate due diligence to stakeholders and regulators.</p><img src=""https://source.unsplash.com/600x400/?risk,assessment"" alt=""Risk Assessment""><h2>Assessment Methodologies</h2><p>Methodologies include qualitative (high/medium/low ratings), quantitative (numerical values and calculations), and hybrid approaches. Choose based on organizational maturity, data availability, and stakeholder needs.</p><h2>Risk Assessment Process</h2><p>Process includes asset identification, threat identification, vulnerability identification, existing control evaluation, likelihood and impact assessment, risk calculation, risk prioritization, and treatment recommendation.</p><h2>Threat Modeling</h2><p>Threat modeling identifies potential threats through frameworks like STRIDE (Spoofing, Tampering, Repudiation, Information Disclosure, Denial of Service, Elevation of Privilege) systematically analyzing attack possibilities.</p><h2>Continuous Risk Management</h2><p>Risk is dynamic—regular reassessment addresses new threats, vulnerabilities, and business changes. Implement continuous risk monitoring, triggered assessments for significant changes, and annual comprehensive reviews.</p>","Conduct security risk assessments using proven methods."
Third-Party Risk Management,third-party-risk-management,Compliance & Governance,Risk Management,Wilson S,"third-party, vendor, risk","<h2>Third-Party Risk Overview</h2><p>Third-party vendors, partners, and suppliers introduce risk through access to data, systems, or facilities. Third-party risk management (TPRM) assesses and mitigates risks throughout vendor lifecycle.</p><img src=""https://source.unsplash.com/600x400/?vendor,risk"" alt=""Third-Party Risk""><h2>Vendor Assessment</h2><p>Vendor assessment includes security questionnaires, documentation review, on-site audits, penetration testing, SOC 2 or ISO 27001 review, and financial stability evaluation. Assessment depth matches vendor risk and criticality.</p><h2>Contractual Controls</h2><p>Contracts should include security requirements, audit rights, breach notification obligations, data protection clauses, liability provisions, termination conditions, and specific controls based on data sensitivity and access level.</p><h2>Continuous Monitoring</h2><p>Monitor vendors continuously through security rating services, regular reassessments, security questionnaires updates, incident notifications, and performance metrics. Don't treat vendor security as one-time assessment.</p><h2>Incident Response</h2><p>Establish vendor incident response procedures including notification requirements, communication protocols, joint investigation processes, and remediation expectations. Test procedures before actual incidents occur.</p>","Manage third-party and vendor security risks."
Security Governance Model,security-governance-model,Compliance & Governance,Governance,Wilson S,"governance, security, model","<h2>Security Governance Fundamentals</h2><p>Security governance provides oversight, direction, and accountability for security programs. Effective governance aligns security with business objectives, manages risk appropriately, and ensures compliance with obligations.</p><img src=""https://source.unsplash.com/600x400/?governance,leadership"" alt=""Security Governance""><h2>Governance Structure</h2><p>Governance structure includes board or executive oversight, security steering committee for strategic decisions, CISO leading security program, security councils for coordination, and clear reporting relationships ensuring accountability.</p><h2>Roles and Responsibilities</h2><p>Define security responsibilities for board (oversight), executive management (support), CISO (program leadership), business units (risk ownership), IT (implementation), and all employees (security awareness and compliance).</p><h2>Decision-Making Processes</h2><p>Establish processes for risk acceptance decisions, security investment prioritization, policy approval, exception handling, and strategic direction. Document decision criteria, approval authorities, and escalation procedures.</p><h2>Metrics and Reporting</h2><p>Governance requires regular reporting to executives and board including risk posture, compliance status, incidents, metrics trends, and program maturity. Tailor reporting to audience with appropriate detail and business context.</p>","Establish a security governance model for your organization."
Mobile Device Management,mobile-device-management,Endpoint Security,MDM,Wilson S,"mdm, mobile, device management","<h2>MDM Overview</h2><p>Mobile Device Management (MDM) secures, monitors, and manages mobile devices accessing corporate resources. MDM addresses BYOD security, remote workforce, and diverse mobile device ecosystem challenges.</p><img src=""https://source.unsplash.com/600x400/?mobile,management"" alt=""Mobile Device Management""><h2>Core MDM Capabilities</h2><p>MDM provides device enrollment, configuration management, app distribution and management, security policy enforcement, remote wipe capabilities, encryption enforcement, and compliance monitoring for mobile devices.</p><h2>BYOD vs Corporate-Owned</h2><p>Corporate-owned devices enable full MDM control. BYOD requires privacy-respecting approaches like containerization separating work and personal data, app-level management, or conditional access without full device control.</p><h2>Security Policies</h2><p>Mobile policies should include device encryption, screen lock requirements, app whitelisting/blacklisting, OS update requirements, jailbreak/root detection, VPN requirements, and data loss prevention controls.</p><h2>Implementation Challenges</h2><p>Balance security with user privacy and experience. Address device diversity across iOS, Android, and other platforms. Integrate with identity systems, provide user support, and establish clear BYOD policies communicating expectations.</p>","Implement mobile device management for corporate devices."
Endpoint Detection and Response,endpoint-detection-and-response,Endpoint Security,EDR,Wilson S,"edr, endpoint, detection","<h2>EDR Fundamentals</h2><p>Endpoint Detection and Response (EDR) provides continuous monitoring and response capabilities for endpoints. EDR detects threats that evade prevention, enables investigation, and facilitates rapid response containing attacks.</p><img src=""https://source.unsplash.com/600x400/?endpoint,detection"" alt=""EDR""><h2>EDR Capabilities</h2><p>EDR provides comprehensive endpoint visibility, behavioral analysis detecting anomalies, threat intelligence integration, automated threat hunting, incident investigation with forensic data, and automated or manual response actions.</p><h2>Detection Techniques</h2><p>EDR uses signature-based detection for known threats, behavioral analysis for anomalies, machine learning for pattern recognition, and threat intelligence for emerging threats. Multi-layered detection improves coverage.</p><h2>Response Actions</h2><p>EDR response includes endpoint isolation preventing lateral movement, process termination stopping malicious activity, file quarantine, remediation rollback changes, and evidence collection for investigation and forensics.</p><h2>XDR Evolution</h2><p>Extended Detection and Response (XDR) extends EDR across network, cloud, and email, providing unified visibility and correlated detection. XDR reduces tool sprawl and improves detection through cross-domain correlation.</p>","Deploy endpoint detection and response (EDR) solutions."
Antivirus and Anti-Malware,antivirus-and-anti-malware,Endpoint Security,Protection,Wilson S,"antivirus, anti-malware, protection","<h2>Antivirus Overview</h2><p>Antivirus and anti-malware solutions protect endpoints from malicious software. While signatures detect known threats, modern solutions add behavioral analysis, machine learning, and cloud-based protection for comprehensive defense.</p><img src=""https://source.unsplash.com/600x400/?antivirus,protection"" alt=""Antivirus Protection""><h2>Detection Methods</h2><p>Antivirus uses signature-based detection matching known malware patterns, heuristic analysis identifying suspicious characteristics, behavioral monitoring detecting malicious actions, and sandboxing analyzing unknown files safely.</p><h2>Next-Gen Antivirus</h2><p>Next-generation antivirus (NGAV) adds machine learning, behavioral analysis, exploit prevention, and threat intelligence beyond traditional signatures. NGAV detects zero-day threats and fileless malware evading signature-based detection.</p><h2>Management and Updates</h2><p>Centralized management deploys policies, monitors protection status, and ensures updates across endpoints. Regular signature updates are critical—automated updates with testing procedures prevent compatibility issues.</p><h2>Performance Considerations</h2><p>Balance protection with system performance through scheduling scans during off-hours, optimizing scan targets, excluding trusted applications carefully, and right-sizing solutions for endpoint capabilities.</p>","Choose and deploy antivirus and anti-malware solutions."
Device Hardening Guide,device-hardening-guide,Endpoint Security,Hardening,Wilson S,"hardening, endpoint, security","<h2>Device Hardening Overview</h2><p>Device hardening reduces attack surface by disabling unnecessary services, removing unused software, configuring secure settings, and implementing security controls. Hardened devices resist compromise and limit damage if breached.</p><img src=""https://source.unsplash.com/600x400/?hardening,security"" alt=""Device Hardening""><h2>Operating System Hardening</h2><p>OS hardening includes applying security patches, disabling unnecessary services, configuring secure boot, enabling firewalls, implementing full disk encryption, using standard user accounts, and applying security baselines like CIS benchmarks.</p><h2>Application Hardening</h2><p>Harden applications through keeping software updated, removing unused applications, configuring secure settings, implementing application whitelisting, using least privilege for execution, and disabling macros/scripts in documents.</p><h2>Configuration Management</h2><p>Maintain hardened state through configuration management tools, regular compliance scanning, automated remediation of drift, change control for modifications, and documentation of hardening standards and exceptions.</p><h2>User Education</h2><p>Hardening effectiveness requires user cooperation. Educate users about security settings, explain restrictions, provide alternatives for blocked functionality, and gather feedback for balancing security and usability.</p>","Harden endpoints against security threats and attacks."
BYOD Security Policy,byod-security-policy,Endpoint Security,BYOD,Wilson S,"byod, mobile, policy","<h2>BYOD Overview</h2><p>Bring Your Own Device (BYOD) allows employees to use personal devices for work. BYOD policies must balance employee privacy, security requirements, cost savings, and user productivity.</p><img src=""https://source.unsplash.com/600x400/?byod,mobile"" alt=""BYOD Security""><h2>Policy Components</h2><p>BYOD policy should define eligible devices, enrollment requirements, security controls (encryption, passwords), acceptable use, data ownership, privacy boundaries, support limitations, and exit procedures including data wipe.</p><h2>Security Controls</h2><p>Implement containerization separating work and personal data, mobile application management (MAM) for work apps, conditional access requiring compliance, encryption for work data, and remote wipe limited to work containers.</p><h2>Privacy Considerations</h2><p>Respect employee privacy through container-based approaches, limiting monitoring to work data, clear communication about what's monitored, user consent, and proportional controls based on data sensitivity.</p><h2>Support and Liability</h2><p>Define support scope—typically limited for personal devices. Establish liability for lost/stolen devices, acceptable use violations, and data breaches. Consider stipends for work device use on personal plans.</p>","Create secure Bring Your Own Device (BYOD) policies."
Secure SDLC Practices,secure-sdlc-practices,Application Security,SDLC,Wilson S,"sdlc, secure development, practices","<h2>Secure SDLC Overview</h2><p>Secure Software Development Lifecycle (SDLC) integrates security throughout development from requirements to deployment. Early security integration reduces vulnerabilities, lowers remediation costs, and improves application security posture.</p><img src=""https://source.unsplash.com/600x400/?sdlc,development"" alt=""Secure SDLC""><h2>Security Requirements</h2><p>Define security requirements during planning including authentication, authorization, data protection, input validation, logging, and compliance needs. Security requirements drive architecture and implementation decisions.</p><h2>Threat Modeling</h2><p>Conduct threat modeling during design identifying potential threats, attack vectors, and security controls. Use frameworks like STRIDE or PASTA to systematically analyze security risks in application architecture.</p><h2>Secure Coding</h2><p>Implement secure coding practices including input validation, output encoding, parameterized queries preventing injection, proper authentication and session management, and secure error handling without information disclosure.</p><h2>Security Testing</h2><p>Integrate security testing including static analysis (SAST) during development, dynamic analysis (DAST) during testing, dependency scanning, security code review, and penetration testing before release.</p>","Integrate security into the software development lifecycle."
DevSecOps Implementation,devsecops-implementation,Application Security,DevSecOps,Wilson S,"devsecops, security, development","<h2>DevSecOps Overview</h2><p>DevSecOps integrates security into DevOps practices, making security shared responsibility across development, security, and operations. Automation and collaboration enable fast, secure software delivery.</p><img src=""https://source.unsplash.com/600x400/?devsecops,automation"" alt=""DevSecOps""><h2>Cultural Shift</h2><p>DevSecOps requires cultural change making security everyone's responsibility. Foster collaboration between teams, provide security training for developers, embed security champions in teams, and celebrate security wins.</p><h2>Pipeline Security</h2><p>Secure CI/CD pipelines through secret management, access controls, pipeline as code, security scanning gates, signed artifacts, and audit logging. Pipeline security prevents supply chain attacks and ensures deployment integrity.</p><h2>Automated Security Testing</h2><p>Automate security testing in pipelines including SAST for code analysis, dependency scanning for vulnerable libraries, container scanning, DAST for running applications, and infrastructure as code scanning.</p><h2>Continuous Monitoring</h2><p>DevSecOps extends to production with continuous monitoring, runtime application self-protection (RASP), security observability, automated incident response, and feedback loops improving security throughout lifecycle.</p>","Implement DevSecOps for security automation in CI/CD."
OWASP Top 10 Guide,owasp-top-10-guide,Application Security,Web Security,Wilson S,"owasp, web security, vulnerabilities","<h2>OWASP Top 10 Overview</h2><p>OWASP Top 10 represents most critical web application security risks. Understanding and mitigating these vulnerabilities significantly improves application security posture and reduces breach risk.</p><img src=""https://source.unsplash.com/600x400/?owasp,websecurity"" alt=""OWASP Top 10""><h2>Top Vulnerabilities</h2><p>Current Top 10 includes Broken Access Control, Cryptographic Failures, Injection, Insecure Design, Security Misconfiguration, Vulnerable Components, Authentication Failures, Software and Data Integrity Failures, Logging Failures, and SSRF.</p><h2>Mitigation Strategies</h2><p>Mitigate through secure design, input validation, output encoding, parameterized queries, strong authentication, secure session management, proper access controls, encryption, security logging, and regular security updates.</p><h2>Development Integration</h2><p>Integrate OWASP Top 10 into SDLC through security requirements, developer training, secure coding standards, automated testing for OWASP risks, code review checklists, and security testing before deployment.</p><h2>Continuous Awareness</h2><p>OWASP Top 10 evolves—stay current with updates, emerging risks, and evolving attack techniques. Subscribe to OWASP resources, participate in community, and continuously improve security practices.</p>","Address OWASP Top 10 web application vulnerabilities."
Secure Coding Standards,secure-coding-standards,Application Security,Development,Wilson S,"secure coding, standards, development","<h2>Secure Coding Importance</h2><p>Secure coding standards provide developers with guidelines preventing common vulnerabilities. Standards ensure consistent security practices, reduce vulnerabilities, and support secure-by-design development.</p><img src=""https://source.unsplash.com/600x400/?coding,standards"" alt=""Secure Coding""><h2>Core Principles</h2><p>Secure coding principles include input validation, output encoding, authentication and session management, access control, cryptographic practices, error handling, logging, and data protection. Principles apply across languages and frameworks.</p><h2>Language-Specific Guidelines</h2><p>Develop language-specific standards for used technologies covering framework security features, common pitfalls, secure libraries, and language-specific vulnerabilities. Provide code examples and anti-patterns.</p><h2>Enforcement and Training</h2><p>Enforce standards through code review, automated linting, security testing, and peer accountability. Provide training on standards, update regularly with lessons learned, and make standards accessible as reference.</p><h2>Continuous Improvement</h2><p>Evolve standards based on vulnerability trends, new attack techniques, framework updates, and development feedback. Regular updates ensure standards remain relevant and effective.</p>","Follow secure coding standards for vulnerability prevention."
Application Security Testing,application-security-testing,Application Security,Testing,Wilson S,"ast, security testing, application","<h2>Application Security Testing Overview</h2><p>Application Security Testing (AST) identifies vulnerabilities in applications through various testing methods. Comprehensive AST combines multiple techniques throughout SDLC for thorough coverage.</p><img src=""https://source.unsplash.com/600x400/?testing,security"" alt=""Application Security Testing""><h2>Testing Types</h2><p>AST includes Static Application Security Testing (SAST) analyzing source code, Dynamic Application Security Testing (DAST) testing running applications, Interactive AST (IAST) combining both, and Software Composition Analysis (SCA) for dependencies.</p><h2>SAST Implementation</h2><p>Integrate SAST into IDE and CI/CD pipelines for early detection. Configure for your codebase, tune to reduce false positives, prioritize findings by severity, and provide developer training on remediation.</p><h2>DAST Implementation</h2><p>Run DAST in test environments against running applications. Configure authentication, crawl application, test for OWASP vulnerabilities, and schedule regular scans. DAST finds runtime and configuration issues SAST misses.</p><h2>Testing Strategy</h2><p>Effective AST strategy combines automated tools with manual testing, integrates throughout SDLC, prioritizes based on risk, tracks metrics, and continuously improves based on findings and false positive analysis.</p>","Comprehensive guide to application security testing methods."
SQL Injection Prevention,sql-injection-prevention,Application Security,Web Security,Wilson S,"sql injection, prevention, security","<h2>SQL Injection Overview</h2><p>SQL injection occurs when attackers manipulate SQL queries through untrusted input. SQLi can lead to data theft, modification, deletion, or complete system compromise. Prevention requires proper input handling and secure database access.</p><img src=""https://source.unsplash.com/600x400/?sql,security"" alt=""SQL Injection Prevention""><h2>Prevention Techniques</h2><p>Prevent SQLi through parameterized queries (prepared statements), stored procedures, input validation, least privilege database accounts, and escaping user input. Parameterized queries are most effective defense.</p><h2>Parameterized Queries</h2><p>Parameterized queries separate SQL logic from data, preventing injection. Use prepared statements or ORM frameworks that automatically parameterize queries. Never concatenate user input into SQL strings.</p><h2>Input Validation</h2><p>Validate all user input against expected format, type, length, and range. Use whitelist validation allowing only known-good input. Reject invalid input rather than attempting sanitization which can be bypassed.</p><h2>Defense in Depth</h2><p>Layer defenses including parameterized queries, input validation, least privilege database permissions, web application firewalls, and database activity monitoring. Multiple layers prevent bypass and detect attacks.</p>","Prevent SQL injection attacks in web applications."
