Article Title,Slug,Category,Sub-Category,Owner,Tags,Body (HTML),Meta Description
GraphQL Security Best Practices,graphql-security-best-practices,Application Security,API,Wilson S,"graphql, security, api","<h2>GraphQL Security Overview</h2><p>GraphQL provides flexible APIs but introduces security challenges including query complexity attacks, introspection exposure, and authorization complexity. Proper security implementation prevents abuse and data exposure.</p><img src=""https://source.unsplash.com/600x400/?graphql,api"" alt=""GraphQL Security""><h2>Query Complexity</h2><p>Implement query depth limiting preventing deeply nested queries, query complexity analysis calculating query cost, rate limiting based on query complexity, and timeout enforcement for long-running queries.</p><h2>Authorization</h2><p>Implement field-level authorization controlling data access granularly, validate permissions for each field, avoid relying on client to request only authorized data, and use data loaders for efficient authorization checks.</p><h2>Introspection Control</h2><p>Disable introspection in production preventing schema disclosure, use allowlisting for known queries, implement authentication before introspection access, and provide documentation through controlled channels.</p><h2>Input Validation</h2><p>Validate all GraphQL inputs including variables, use schema validation, sanitize inputs preventing injection, implement proper error handling without information disclosure, and log suspicious queries.</p>","Secure GraphQL APIs against complexity attacks and authorization issues."
Email Gateway Configuration,email-gateway-configuration-security,Communication Security,Email,Wilson S,"email gateway, configuration, security","<h2>Email Gateway Security</h2><p>Email security gateways filter inbound and outbound email protecting against phishing, malware, spam, and data loss. Proper configuration ensures comprehensive email threat protection.</p><img src=""https://source.unsplash.com/600x400/?email,gateway"" alt=""Email Gateway""><h2>Inbound Protection</h2><p>Configure anti-spam filtering, malware scanning, phishing detection, URL reputation checking, attachment sandboxing, and spoofing prevention using SPF/DKIM/DMARC validation for inbound email protection.</p><h2>Outbound Protection</h2><p>Implement DLP scanning for sensitive data, malware scanning preventing infected outbound mail, content filtering, attachment restrictions, and user notifications for policy violations on outbound email.</p><h2>Threat Intelligence</h2><p>Integrate threat intelligence feeds for real-time protection, use reputation services for sender/URL validation, implement machine learning for anomaly detection, and share threat data with security community.</p><h2>User Experience</h2><p>Balance security with usability through quarantine management, user notification preferences, whitelist/blacklist capabilities, and easy spam reporting mechanisms encouraging user participation in email security.</p>","Configure email gateways for comprehensive email security and threat protection."
Email Encryption S/MIME,email-encryption-smime-implementation,Communication Security,Email,Wilson S,"email encryption, smime, security","","Implement S/MIME email encryption for secure business communications."
Email Spoofing Prevention,email-spoofing-prevention-dmarc,Communication Security,Email,Wilson S,"email spoofing, dmarc, prevention","","Prevent email spoofing with DMARC, SPF, and DKIM implementation."
Microsoft Teams Security,microsoft-teams-security-configuration,Communication Security,Collaboration,Wilson S,"teams, microsoft, security","","Secure Microsoft Teams with proper configuration and controls."
Slack Security Best Practices,slack-security-best-practices,Communication Security,Collaboration,Wilson S,"slack, security, collaboration","","Secure Slack workspaces with security best practices."
Video Conferencing Security,video-conferencing-security-zoom,Communication Security,Conferencing,Wilson S,"video conference, zoom, security","","Secure video conferencing preventing unauthorized access and zoombombing."
VoIP Fraud Prevention,voip-fraud-prevention-strategies,Communication Security,VoIP,Wilson S,"voip fraud, prevention, toll","","Prevent VoIP fraud and toll fraud attacks on telephony systems."
SIP Security Configuration,sip-security-configuration-voip,Communication Security,VoIP,Wilson S,"sip, voip, security","","Secure SIP protocol against eavesdropping and attacks."
WebRTC Security,webrtc-security-implementation,Communication Security,Web,Wilson S,"webrtc, security, web","","Secure WebRTC implementations in web applications."
DNS Filtering Solutions,dns-filtering-security-solutions,Communication Security,DNS,Wilson S,"dns filtering, security, malware","","Implement DNS filtering for malware and phishing protection."
DNS Tunneling Detection,dns-tunneling-detection-prevention,Communication Security,DNS,Wilson S,"dns tunneling, detection, exfiltration","","Detect DNS tunneling used for data exfiltration and C2."
CDN Security Configuration,cdn-security-configuration-cloudflare,Communication Security,Web,Wilson S,"cdn, cloudflare, security","","Secure content delivery networks and edge caching."
DDoS Mitigation Strategies,ddos-mitigation-strategies-protection,Communication Security,Protection,Wilson S,"ddos, mitigation, protection","","Mitigate DDoS attacks with layered protection strategies."
NTP Security Configuration,ntp-security-configuration-time,Communication Security,Protocols,Wilson S,"ntp, security, time","","Secure Network Time Protocol preventing time-based attacks."
SNMP Security v3,snmp-v3-security-configuration,Communication Security,Protocols,Wilson S,"snmp, security, monitoring","","Secure SNMP v3 for safe network device monitoring."
SFTP Configuration,sftp-secure-file-transfer,Communication Security,Protocols,Wilson S,"sftp, file transfer, security","","Configure SFTP for secure file transfer replacing FTP."
RDP Security Hardening,rdp-security-hardening-remote,Communication Security,Remote Access,Wilson S,"rdp, remote desktop, security","","Harden Remote Desktop Protocol against attacks."
SSH Hardening Guide,ssh-hardening-security-guide,Communication Security,Protocols,Wilson S,"ssh, hardening, security","","Harden SSH for secure remote administration."
Industrial IoT Security,industrial-iot-security-iiot,Emerging Technologies,IIoT,Wilson S,"iiot, industrial iot, security","","Secure Industrial IoT devices and networks in manufacturing."
Smart City Security,smart-city-security-challenges,Emerging Technologies,IoT,Wilson S,"smart city, iot, security","","Address security challenges in smart city deployments."
Connected Vehicle Security,connected-vehicle-security-automotive,Emerging Technologies,IoT,Wilson S,"connected vehicle, automotive, security","","Secure connected and autonomous vehicles from cyber attacks."
Medical Device Security,medical-device-security-healthcare,Emerging Technologies,IoT,Wilson S,"medical device, healthcare, security","","Secure medical IoT devices and healthcare systems."
Smart Home Security,smart-home-security-iot,Emerging Technologies,IoT,Wilson S,"smart home, iot, security","","Secure smart home devices and networks."
Wearable Device Security,wearable-device-security-iot,Emerging Technologies,IoT,Wilson S,"wearable, device, security","","Secure wearable devices and protect personal data."
Drone Security,drone-security-uav,Emerging Technologies,IoT,Wilson S,"drone, uav, security","","Secure drones and unmanned aerial vehicles."
SCADA Security Best Practices,scada-security-best-practices,Emerging Technologies,OT/ICS,Wilson S,"scada, ics, security","","Implement SCADA security best practices for critical infrastructure."
PLC Security,plc-security-industrial-control,Emerging Technologies,OT/ICS,Wilson S,"plc, security, industrial","","Secure programmable logic controllers in industrial environments."
OT Network Segmentation,ot-network-segmentation-purdue,Emerging Technologies,OT/ICS,Wilson S,"ot, segmentation, purdue","","Implement OT network segmentation using Purdue model."
ICS Incident Response,ics-incident-response-ot,Emerging Technologies,OT/ICS,Wilson S,"ics, incident response, ot","","Respond to ICS security incidents safely and effectively."
Machine Learning Security,machine-learning-security-ai,Emerging Technologies,AI/ML,Wilson S,"machine learning, ai, security","","Secure machine learning models and AI systems."
AI Model Poisoning,ai-model-poisoning-attacks,Emerging Technologies,AI/ML,Wilson S,"ai poisoning, model, attacks","","Prevent AI model poisoning and adversarial attacks."
Federated Learning Security,federated-learning-security,Emerging Technologies,AI/ML,Wilson S,"federated learning, security, privacy","","Secure federated learning protecting privacy and models."
Blockchain Smart Contracts,blockchain-smart-contracts-security,Emerging Technologies,Blockchain,Wilson S,"blockchain, smart contracts, security","","Secure blockchain smart contracts against vulnerabilities."
Cryptocurrency Wallet Security,cryptocurrency-wallet-security,Emerging Technologies,Blockchain,Wilson S,"cryptocurrency, wallet, security","","Secure cryptocurrency wallets and private keys."
NFT Security,nft-security-considerations,Emerging Technologies,Blockchain,Wilson S,"nft, security, blockchain","","Secure NFT platforms and prevent fraud."
DeFi Security,defi-security-decentralized-finance,Emerging Technologies,Blockchain,Wilson S,"defi, security, finance","","Secure DeFi platforms and protocols."
Post-Quantum Cryptography,post-quantum-cryptography-migration,Emerging Technologies,Quantum,Wilson S,"post-quantum, cryptography, migration","","Migrate to post-quantum cryptography preparing for quantum computing."
Quantum Key Distribution,quantum-key-distribution-qkd,Emerging Technologies,Quantum,Wilson S,"qkd, quantum, cryptography","","Implement quantum key distribution for secure communications."
Edge Computing Architecture,edge-computing-security-architecture,Emerging Technologies,Edge,Wilson S,"edge computing, architecture, security","","Design secure edge computing architectures."
5G Network Security,5g-network-security-implementation,Emerging Technologies,5G,Wilson S,"5g, network, security","","Secure 5G networks and address new attack vectors."
Zero Knowledge Proofs,zero-knowledge-proofs-zkp,Emerging Technologies,Privacy,Wilson S,"zkp, zero knowledge, privacy","","Implement zero knowledge proofs for privacy preservation."
Differential Privacy,differential-privacy-implementation,Emerging Technologies,Privacy,Wilson S,"differential privacy, implementation","","Implement differential privacy protecting individual data."
Secure Multi-Party Computation,secure-multi-party-computation-mpc,Emerging Technologies,Privacy,Wilson S,"mpc, secure computation, privacy","","Use secure multi-party computation for privacy-preserving analytics."
Homomorphic Encryption Applications,homomorphic-encryption-applications,Emerging Technologies,Encryption,Wilson S,"homomorphic, encryption, applications","","Apply homomorphic encryption for secure cloud computing."
CISSP Study Guide,cissp-study-guide-preparation,Training & Awareness,Certifications,Wilson S,"cissp, study, certification","","Comprehensive CISSP study guide and exam preparation."
CISM Study Guide,cism-study-guide-preparation,Training & Awareness,Certifications,Wilson S,"cism, study, certification","","CISM certification study guide for security managers."
CEH Study Resources,ceh-study-resources-preparation,Training & Awareness,Certifications,Wilson S,"ceh, ethical hacking, study","","CEH study resources and ethical hacking preparation."
Security+ Study Guide,security-plus-study-guide-comptia,Training & Awareness,Certifications,Wilson S,"security+, comptia, study","","CompTIA Security+ study guide and exam preparation."
OSCP Preparation,oscp-preparation-guide,Training & Awareness,Certifications,Wilson S,"oscp, pentest, preparation","","OSCP certification preparation guide for penetration testing."
GIAC Certifications,giac-certifications-guide,Training & Awareness,Certifications,Wilson S,"giac, sans, certifications","","GIAC certification guide and preparation resources."
AWS Certified Security,aws-certified-security-specialty,Training & Awareness,Certifications,Wilson S,"aws, certification, security","","AWS Certified Security Specialty preparation guide."
Azure Security Certifications,azure-security-certifications-guide,Training & Awareness,Certifications,Wilson S,"azure, certification, security","","Azure security certification paths and preparation."
Cloud Security Certifications,cloud-security-certifications-ccsp,Training & Awareness,Certifications,Wilson S,"cloud, ccsp, certification","","Cloud security certifications including CCSP."
Information Security Career Path,information-security-career-path,Training & Awareness,Career,Wilson S,"career, infosec, path","","Navigate information security career paths and opportunities."
SOC Analyst Career,soc-analyst-career-guide,Training & Awareness,Career,Wilson S,"soc analyst, career, guide","","SOC analyst career guide and skill requirements."
Penetration Tester Career,penetration-tester-career-path,Training & Awareness,Career,Wilson S,"pentester, career, path","","Penetration tester career path and skill development."
Security Architect Career,security-architect-career-guide,Training & Awareness,Career,Wilson S,"security architect, career, guide","","Security architect career guide and requirements."
CISO Career Path,ciso-career-path-guide,Training & Awareness,Career,Wilson S,"ciso, career, leadership","","CISO career path and executive leadership development."
Cybersecurity Bootcamps,cybersecurity-bootcamps-training,Training & Awareness,Training,Wilson S,"bootcamp, training, cybersecurity","","Cybersecurity bootcamps and intensive training programs."
Security Awareness Training Program,security-awareness-training-program,Training & Awareness,Training,Wilson S,"awareness, training, program","","Build comprehensive security awareness training programs."
Phishing Simulation Platform,phishing-simulation-platform-training,Training & Awareness,Training,Wilson S,"phishing, simulation, training","","Implement phishing simulation platforms for user training."
Tabletop Exercise Planning,tabletop-exercise-planning-incident,Training & Awareness,Training,Wilson S,"tabletop, exercise, incident","","Plan tabletop exercises for incident response training."
Red Team vs Blue Team,red-team-vs-blue-team-training,Training & Awareness,Training,Wilson S,"red team, blue team, training","","Understand red team and blue team roles and training."
Cyber Range Training,cyber-range-training-platform,Training & Awareness,Training,Wilson S,"cyber range, training, platform","","Use cyber ranges for hands-on security training."
CTF Platform Guide,ctf-platform-guide-training,Training & Awareness,Resources,Wilson S,"ctf, platform, training","","CTF platforms for skill development and practice."
HackTheBox Guide,hackthebox-guide-training,Training & Awareness,Resources,Wilson S,"hackthebox, training, practice","","HackTheBox platform guide for penetration testing practice."
TryHackMe Guide,tryhackme-guide-training,Training & Awareness,Resources,Wilson S,"tryhackme, training, learning","","TryHackMe platform guide for cybersecurity learning."
Security Blogs and Podcasts,security-blogs-podcasts-resources,Training & Awareness,Resources,Wilson S,"blogs, podcasts, resources","","Top security blogs and podcasts for continuous learning."
Security Conferences,security-conferences-events,Training & Awareness,Resources,Wilson S,"conferences, events, security","","Major security conferences and events to attend."
Open Source Security Tools,open-source-security-tools,Training & Awareness,Resources,Wilson S,"open source, tools, security","","Essential open source security tools and resources."
Security Research Papers,security-research-papers-academic,Training & Awareness,Resources,Wilson S,"research, papers, academic","","Academic security research papers and publications."
Bug Bounty Platforms,bug-bounty-platforms-guide,Training & Awareness,Programs,Wilson S,"bug bounty, platforms, hacking","","Bug bounty platforms for ethical hacking and rewards."
Security Champions Network,security-champions-network-program,Training & Awareness,Programs,Wilson S,"security champions, network, program","","Build security champions networks across organizations."
Mentorship Programs,mentorship-programs-cybersecurity,Training & Awareness,Programs,Wilson S,"mentorship, programs, career","","Cybersecurity mentorship programs for career development."
