Article Title,Slug,Category,Sub-Category,Owner,Tags,Body (HTML),Meta Description
XSS Attack Mitigation,xss-attack-mitigation,Application Security,Web Security,Wilson S,"xss, cross-site scripting, prevention","<h2>XSS Overview</h2><p>Cross-Site Scripting (XSS) allows attackers to inject malicious scripts into web pages viewed by other users. XSS can steal credentials, hijack sessions, deface websites, or distribute malware. Multiple XSS types require different mitigations.</p><img src=""https://source.unsplash.com/600x400/?xss,security"" alt=""XSS Prevention""><h2>XSS Types</h2><p>Reflected XSS executes immediately from request, Stored XSS persists in database, and DOM-based XSS occurs client-side. Each type requires specific prevention and testing approaches.</p><h2>Output Encoding</h2><p>Encode all untrusted data before rendering in HTML, JavaScript, CSS, or URL contexts. Use context-appropriate encoding: HTML entity encoding, JavaScript encoding, CSS encoding, or URL encoding based on output location.</p><h2>Content Security Policy</h2><p>Implement Content Security Policy (CSP) headers restricting script sources, inline scripts, and unsafe JavaScript functions. CSP provides defense-in-depth preventing XSS exploitation even if injection occurs.</p><h2>Framework Protection</h2><p>Use frameworks with automatic XSS protection like React, Angular, or Vue. Avoid bypassing framework protections through innerHTML or dangerouslySetInnerHTML. Understand framework security features and limitations.</p>","Mitigate cross-site scripting (XSS) vulnerabilities."
CSRF Protection Methods,csrf-protection-methods,Application Security,Web Security,Wilson S,"csrf, protection, web security","<h2>CSRF Overview</h2><p>Cross-Site Request Forgery (CSRF) tricks users into executing unwanted actions while authenticated. CSRF exploits trust that websites have in user browsers, enabling unauthorized transactions, configuration changes, or data modifications.</p><img src=""https://source.unsplash.com/600x400/?csrf,security"" alt=""CSRF Protection""><h2>CSRF Tokens</h2><p>CSRF tokens are unpredictable values included in forms and verified server-side. Generate unique tokens per session or request, include in forms as hidden fields, verify on submission, and reject requests with invalid tokens.</p><h2>SameSite Cookies</h2><p>SameSite cookie attribute prevents browsers from sending cookies with cross-site requests. Use SameSite=Lax or SameSite=Strict for session cookies preventing CSRF. SameSite provides defense-in-depth with token-based protection.</p><h2>Additional Protections</h2><p>Verify Origin and Referer headers, require re-authentication for sensitive actions, use custom headers for AJAX requests, and implement user interaction requirements for critical operations.</p><h2>Framework Support</h2><p>Most frameworks provide built-in CSRF protection. Enable framework CSRF features, configure properly, ensure tokens are validated, and understand framework-specific implementation to avoid misconfigurations.</p>","Protect against Cross-Site Request Forgery (CSRF) attacks."
Secure API Design,secure-api-design,Application Security,API Security,Wilson S,"api, design, security","<h2>API Security Principles</h2><p>Secure API design considers authentication, authorization, input validation, rate limiting, and data protection from inception. Security-first design prevents vulnerabilities and simplifies security implementation and maintenance.</p><img src=""https://source.unsplash.com/600x400/?api,design"" alt=""Secure API Design""><h2>Authentication and Authorization</h2><p>Implement strong authentication using OAuth 2.0, API keys, or JWT tokens. Enforce authorization checking permissions for every request, implement least privilege, and validate access to specific resources using object-level authorization.</p><h2>Input Validation</h2><p>Validate all API inputs against expected schemas, types, ranges, and formats. Reject invalid input with descriptive errors. Use schema validation libraries ensuring consistent validation across endpoints.</p><h2>Rate Limiting</h2><p>Implement rate limiting preventing abuse and DoS attacks. Use tiered limits based on authentication level, return appropriate HTTP status codes, and monitor for limit violations indicating attacks or misbehaving clients.</p><h2>API Versioning</h2><p>Design versioning strategy allowing security updates without breaking clients. Use URL versioning, header versioning, or content negotiation. Deprecate insecure versions with migration guidance and sunset policies.</p>","Design secure APIs with authentication and authorization."
API Rate Limiting,api-rate-limiting,Application Security,API Security,Wilson S,"api, rate limiting, security","<h2>Rate Limiting Purpose</h2><p>API rate limiting restricts request frequency preventing abuse, DoS attacks, brute force attempts, and excessive resource consumption. Rate limiting ensures API availability, protects backend systems, and enforces fair usage.</p><img src=""https://source.unsplash.com/600x400/?api,ratelimit"" alt=""API Rate Limiting""><h2>Rate Limiting Strategies</h2><p>Strategies include fixed window (requests per time period), sliding window (more accurate), token bucket (allows bursts), and leaky bucket (smooth rate). Choose based on use case and technical requirements.</p><h2>Implementation Approaches</h2><p>Implement rate limiting at API gateway, application level, or CDN. Use distributed rate limiting with Redis or similar for multi-instance deployments ensuring consistent limits across infrastructure.</p><h2>Limit Definition</h2><p>Define limits based on user tier (free vs paid), endpoint sensitivity, resource cost, and business requirements. Provide different limits for authentication levels, implement burst allowances, and adjust based on usage patterns.</p><h2>Client Communication</h2><p>Communicate limits through HTTP headers (X-RateLimit-Limit, X-RateLimit-Remaining, X-RateLimit-Reset), return 429 Too Many Requests status, provide Retry-After header, and document limits clearly in API documentation.</p>","Implement API rate limiting for security and availability."
Email Security Gateway,email-security-gateway,Communication Security,Email,Wilson S,"email, gateway, security","<h2>Email Gateway Overview</h2><p>Email Security Gateways (ESG) protect against email-borne threats including phishing, malware, spam, and data loss. ESGs filter inbound and outbound email applying multiple security layers before delivery.</p><img src=""https://source.unsplash.com/600x400/?email,gateway"" alt=""Email Security Gateway""><h2>Threat Protection</h2><p>ESGs detect threats through reputation filtering, spam detection, malware scanning, URL analysis, attachment sandboxing, impersonation detection, and phishing identification using machine learning and threat intelligence.</p><h2>DLP Integration</h2><p>Email DLP prevents data loss by scanning outbound email for sensitive data, enforcing encryption for confidential information, blocking unauthorized recipients, and providing user warnings or requiring approval for policy violations.</p><h2>Authentication</h2><p>ESGs enforce email authentication validating SPF, DKIM, and DMARC preventing spoofing. Configure DMARC policies, monitor authentication results, and gradually enforce strict policies after validation.</p><h2>Administration</h2><p>Effective ESG management requires policy tuning reducing false positives, quarantine review and management, user training on reporting suspicious email, and integration with SIEM for security monitoring.</p>","Deploy email security gateways to filter threats."
DMARC Implementation,dmarc-implementation,Communication Security,Email,Wilson S,"dmarc, email, authentication","<h2>DMARC Overview</h2><p>Domain-based Message Authentication, Reporting and Conformance (DMARC) prevents email spoofing and phishing. DMARC builds on SPF and DKIM providing policy enforcement and visibility into email authentication.</p><img src=""https://source.unsplash.com/600x400/?dmarc,email"" alt=""DMARC Implementation""><h2>DMARC Components</h2><p>DMARC requires DNS TXT record defining policy (none, quarantine, reject), alignment requirements for SPF and DKIM, percentage of messages policy applies to, and reporting addresses for aggregate and forensic reports.</p><h2>Implementation Process</h2><p>Start with DMARC policy p=none to monitor without enforcement. Analyze DMARC reports identifying legitimate and malicious sources, fix authentication issues, gradually increase to p=quarantine, then p=reject for full protection.</p><h2>SPF and DKIM Prerequisites</h2><p>DMARC requires SPF and DKIM. Configure SPF records listing authorized sending servers, implement DKIM signing for outbound email, ensure alignment between From domain and SPF/DKIM domains.</p><h2>Report Analysis</h2><p>Analyze DMARC aggregate reports for authentication failures, identify unauthorized senders, monitor authentication trends, and use DMARC reporting tools for visualization and analysis of XML reports.</p>","Implement DMARC for email authentication and anti-spoofing."
SPF and DKIM Setup,spf-and-dkim-setup,Communication Security,Email,Wilson S,"spf, dkim, email security","<h2>Email Authentication Overview</h2><p>SPF and DKIM are email authentication methods preventing spoofing. SPF validates sender IP addresses, DKIM cryptographically signs messages, providing complementary protection when used together with DMARC.</p><img src=""https://source.unsplash.com/600x400/?email,authentication"" alt=""SPF and DKIM""><h2>SPF Configuration</h2><p>SPF (Sender Policy Framework) uses DNS TXT records listing authorized sending IP addresses. Include all legitimate mail servers, use include mechanisms for third-party senders, and define enforcement policy (-all for strict, ~all for soft fail).</p><h2>DKIM Setup</h2><p>DKIM (DomainKeys Identified Mail) signs email with private key, validated using public key in DNS. Generate key pairs, configure mail servers to sign outbound email, publish public keys in DNS, and rotate keys periodically.</p><h2>Best Practices</h2><p>Keep SPF records under 255 characters and 10 DNS lookups, use multiple DKIM keys for different mail streams, test authentication before enforcement, monitor authentication results, and document all authorized senders.</p><h2>Troubleshooting</h2><p>Common issues include SPF lookup limits, DKIM signature failures due to message modification, missing DNS records, and third-party sender integration. Use authentication testing tools to diagnose and resolve issues.</p>","Configure SPF and DKIM for email sender authentication."
Secure Messaging Solutions,secure-messaging-solutions,Communication Security,Messaging,Wilson S,"messaging, encryption, secure communication","<h2>Secure Messaging Importance</h2><p>Secure messaging protects communications from interception, eavesdropping, and tampering. Business communications require encryption, authentication, and privacy features preventing unauthorized access to sensitive conversations.</p><img src=""https://source.unsplash.com/600x400/?messaging,security"" alt=""Secure Messaging""><h2>Encryption Standards</h2><p>Secure messaging uses end-to-end encryption ensuring only participants can read messages. Signal Protocol provides forward secrecy and post-compromise security, OTR offers perfect forward secrecy, and TLS protects transport layer.</p><h2>Enterprise Solutions</h2><p>Enterprise messaging requires encryption, compliance features, data retention, eDiscovery support, and administrative controls. Solutions include Microsoft Teams with encryption, Slack Enterprise Grid, or specialized platforms like Wickr or Wire.</p><h2>Key Features</h2><p>Essential features include end-to-end encryption, user authentication, message integrity verification, forward secrecy, secure file sharing, remote wipe, and compliance capabilities for regulated industries.</p><h2>Implementation Considerations</h2><p>Balance security with usability, provide user training, integrate with identity systems, establish usage policies, consider data residency requirements, and evaluate vendor security practices and certifications.</p>","Deploy secure messaging solutions for encrypted communications."
VoIP Security,voip-security,Communication Security,VoIP,Wilson S,"voip, telephony, security","<h2>VoIP Security Challenges</h2><p>Voice over IP (VoIP) systems face unique security risks including eavesdropping, call interception, toll fraud, DoS attacks, and caller ID spoofing. VoIP security requires network, application, and protocol-level protections.</p><img src=""https://source.unsplash.com/600x400/?voip,phone"" alt=""VoIP Security""><h2>Encryption</h2><p>Encrypt VoIP signaling using TLS and media streams using SRTP (Secure RTP). Configure SIP servers and endpoints to require encryption, manage certificates properly, and use strong cipher suites resisting cryptanalysis.</p><h2>Network Security</h2><p>Segment VoIP traffic using VLANs, implement QoS for reliability, use session border controllers (SBC) at network edge, enable firewall rules allowing only necessary VoIP ports, and monitor for unusual traffic patterns.</p><h2>Authentication and Access</h2><p>Enforce strong authentication for VoIP registration, use certificate-based authentication where possible, implement account lockout policies, restrict international calling based on business needs, and monitor for toll fraud patterns.</p><h2>Monitoring and Incident Response</h2><p>Monitor VoIP systems for security events including failed authentication, unusual call patterns, international calling spikes, and protocol anomalies. Integrate VoIP logs with SIEM for correlation and alerting.</p>","Secure VoIP and telephony systems against attacks."
DNS Security Extensions,dns-security-extensions,Communication Security,DNS,Wilson S,"dnssec, dns, security","<h2>DNS Security Challenges</h2><p>DNS is vulnerable to spoofing, cache poisoning, DDoS attacks, and hijacking. DNS security measures including DNSSEC, filtering, and monitoring protect against attacks exploiting DNS infrastructure.</p><img src=""https://source.unsplash.com/600x400/?dns,security"" alt=""DNS Security""><h2>DNSSEC Implementation</h2><p>DNSSEC adds cryptographic signatures to DNS records ensuring authenticity and integrity. Sign DNS zones with private keys, publish public keys in DNS, enable DNSSEC validation on resolvers, and manage key rollovers.</p><h2>DNS Filtering</h2><p>DNS filtering blocks malicious domains preventing malware communication, phishing sites, and command-and-control servers. Use threat intelligence feeds, create custom blocklists, and monitor blocked queries for threat detection.</p><h2>DNS Over HTTPS/TLS</h2><p>DNS over HTTPS (DoH) or TLS (DoT) encrypts DNS queries preventing eavesdropping and manipulation. Configure resolvers and clients to use encrypted DNS, considering privacy and security trade-offs.</p><h2>Monitoring and Logging</h2><p>Log DNS queries for security analysis, detect DNS tunneling, identify C2 communications, and monitor for DGA (Domain Generation Algorithm) patterns. Integrate DNS logs with SIEM for threat detection.</p>","Implement DNSSEC and other DNS security measures."
TLS Configuration Guide,tls-configuration-guide,Communication Security,Encryption,Wilson S,"tls, ssl, configuration","<h2>TLS Overview</h2><p>Transport Layer Security (TLS) encrypts network communications protecting confidentiality and integrity. Proper TLS configuration uses modern protocols, strong ciphers, and secure practices preventing attacks and ensuring privacy.</p><img src=""https://source.unsplash.com/600x400/?tls,encryption"" alt=""TLS Configuration""><h2>Protocol Selection</h2><p>Use TLS 1.2 minimum, prefer TLS 1.3 for improved security and performance. Disable SSL 2.0, SSL 3.0, TLS 1.0, and TLS 1.1 due to known vulnerabilities. Configure protocol versions based on client compatibility requirements.</p><h2>Cipher Suite Selection</h2><p>Enable strong cipher suites with forward secrecy (ECDHE), authenticated encryption (AES-GCM), and strong key sizes. Disable weak ciphers (RC4, DES, MD5), prefer AEAD ciphers, and order by strength with client respect.</p><h2>Certificate Management</h2><p>Use certificates from trusted CAs, implement certificate pinning for critical connections, monitor certificate expiration, automate renewal with ACME protocol, and use CAA records restricting issuance authorities.</p><h2>Testing and Hardening</h2><p>Test TLS configuration with SSL Labs SSL Test, enable HSTS forcing HTTPS connections, implement OCSP stapling for certificate validation, configure secure renegotiation, and monitor for TLS vulnerabilities.</p>","Configure TLS properly for secure communications."
Network Protocol Security,network-protocol-security,Communication Security,Protocols,Wilson S,"protocols, network, security","<h2>Protocol Security Overview</h2><p>Network protocols vary in security properties—some provide encryption and authentication, others transmit data in clear text. Understanding protocol security helps select appropriate protocols and implement necessary protections.</p><img src=""https://source.unsplash.com/600x400/?network,protocols"" alt=""Protocol Security""><h2>Secure Protocol Alternatives</h2><p>Replace insecure protocols with secure alternatives: SSH instead of Telnet, HTTPS instead of HTTP, SFTP/SCP instead of FTP, SNMPv3 instead of v1/v2, and encrypted email protocols instead of clear text.</p><h2>Legacy Protocol Management</h2><p>Where legacy protocols are necessary, implement compensating controls: network isolation, VPN encapsulation, application-level encryption, strict access controls, and monitoring for protocol abuse.</p><h2>Protocol Hardening</h2><p>Harden protocols through disabling unnecessary features, using strong authentication, enabling encryption where available, implementing access controls, and monitoring protocol usage for anomalies.</p><h2>Zero Trust Approach</h2><p>Apply zero trust principles assuming network protocols are untrusted. Encrypt all communications, authenticate all connections, segment networks preventing lateral movement, and monitor all protocol traffic.</p>","Secure network protocols against common attacks."
Wireless Security Standards,wireless-security-standards,Communication Security,Wireless,Wilson S,"wireless, wifi, security","<h2>Wireless Security Evolution</h2><p>Wireless security standards have evolved from broken WEP to robust WPA3. Modern wireless networks require strong encryption, authentication, and monitoring protecting against eavesdropping, unauthorized access, and attacks.</p><img src=""https://source.unsplash.com/600x400/?wifi,wireless"" alt=""Wireless Security""><h2>WPA3 Implementation</h2><p>WPA3 provides enhanced security with individualized data encryption, protection against brute force attacks, simplified IoT device provisioning, and 192-bit security for enterprise. Deploy WPA3 where supported, use WPA2/WPA3 transition mode for compatibility.</p><h2>Enterprise Authentication</h2><p>WPA3-Enterprise and WPA2-Enterprise use 802.1X authentication with RADIUS servers. Implement certificate-based authentication, EAP-TLS for strongest security, or PEAP for password-based authentication with strong passwords.</p><h2>Network Segmentation</h2><p>Segment wireless networks: separate corporate, guest, and IoT networks using VLANs or separate SSIDs. Implement different security policies, access controls, and monitoring for each segment based on trust level.</p><h2>Monitoring and Detection</h2><p>Monitor wireless networks for rogue access points, unauthorized clients, deauthentication attacks, and evil twin attacks. Use wireless IDS/IPS, regular site surveys, and rogue AP detection tools.</p>","Implement wireless security with WPA3 and best practices."
5G Security Considerations,5g-security-considerations,Communication Security,Wireless,Wilson S,"5g, mobile, security","<h2>5G Security Architecture</h2><p>5G introduces new security capabilities including enhanced encryption, network slicing, and improved authentication. However, 5G also expands attack surface with increased connectivity, edge computing, and IoT integration.</p><img src=""https://source.unsplash.com/600x400/?5g,mobile"" alt=""5G Security""><h2>5G Security Enhancements</h2><p>5G improvements include stronger encryption algorithms, mutual authentication, protection against IMSI catchers, subscriber privacy, and security capabilities for network slicing isolating traffic and services.</p><h2>Security Challenges</h2><p>5G challenges include increased attack surface from massive IoT, edge computing security, network function virtualization risks, supply chain concerns, and roaming security across heterogeneous networks.</p><h2>Enterprise Considerations</h2><p>Enterprise 5G deployment requires understanding shared responsibility with carriers, securing 5G-connected devices, network slicing security, private 5G network security, and integration with existing security infrastructure.</p><h2>Emerging Threats</h2><p>Monitor emerging 5G threats including vulnerabilities in virtualized network functions, edge computing attacks, IoT device compromises, and attacks exploiting 5G features like network slicing or edge computing.</p>","Address security considerations in 5G networks."
IoT Security Framework,iot-security-framework,Emerging Technologies,IoT,Wilson S,"iot, security, framework","<h2>IoT Security Challenges</h2><p>IoT devices introduce security challenges including limited resources, diverse protocols, long lifecycles, and massive scale. Comprehensive IoT security requires device hardening, network controls, and lifecycle management.</p><img src=""https://source.unsplash.com/600x400/?iot,devices"" alt=""IoT Security""><h2>Device Security</h2><p>Secure IoT devices through strong authentication, encrypted communications, secure boot, firmware signing, regular updates, minimal attack surface, and default security configurations. Avoid hardcoded credentials and unnecessary services.</p><h2>Network Security</h2><p>Isolate IoT devices in separate network segments, implement network access control, use IoT-specific firewalls, monitor IoT traffic for anomalies, and restrict IoT device communications to necessary services only.</p><h2>Lifecycle Management</h2><p>IoT security throughout lifecycle includes secure provisioning, certificate management, firmware update mechanisms, vulnerability management, decommissioning procedures, and supply chain security ensuring device integrity.</p><h2>Standards and Frameworks</h2><p>Adopt IoT security frameworks like NIST IoT, IoT Security Foundation guidelines, or industry-specific standards. Frameworks provide structured approaches addressing IoT-specific security challenges and compliance.</p>","Secure IoT devices and ecosystems with proper frameworks."
OT Security Basics,ot-security-basics,Emerging Technologies,OT/ICS,Wilson S,"ot, operational technology, security","<h2>OT Security Overview</h2><p>Operational Technology (OT) controls physical processes in industrial, infrastructure, and critical systems. OT security differs from IT security with priorities on safety, availability, and legacy systems requiring specialized approaches.</p><img src=""https://source.unsplash.com/600x400/?industrial,control"" alt=""OT Security""><h2>OT vs IT Security</h2><p>OT prioritizes availability and safety over confidentiality, has longer lifecycles with legacy systems, uses specialized protocols, requires change management considering safety, and often cannot implement traditional security tools.</p><h2>OT Security Principles</h2><p>OT security includes network segmentation isolating OT from IT, defense-in-depth with multiple layers, least privilege for accounts and devices, monitoring for anomalies, and incident response plans considering operational impact.</p><h2>Risk Assessment</h2><p>OT risk assessment considers safety impacts, regulatory requirements, operational disruption consequences, and cyber-physical risks. Assess risks to processes, not just data, prioritizing safety and availability.</p><h2>Implementation Challenges</h2><p>OT security challenges include legacy systems without security features, vendor dependencies, 24/7 operations limiting maintenance windows, lack of security expertise, and operational vs security priority conflicts.</p>","Fundamentals of operational technology (OT) security."
